user,tweet,date,state,takeFlushot,negativeFlushot
354017586,flu survivor Lesley sunning said thanks to KP for saving her life final winter her lesson get a flu shot http://tco/wmyv367owc,20140930,California,1,0
462640892,Jackson is freaking out crying because Harrison told him they'd have to give him a flu shot in his butt gap,20140108,texas,0,0
366636865,free flu shot clinic planned in quay county http://tco/f2nea8pcqt,20141007,New Mexico,1,0
14775626,Madison's crying because we're leaving so Chris goes do you know where we're going we're all going to get flu shot,20140730,Iowa,0,0
15864446,"“@ebonymhuffman: ""@rivers_flow: who has an installer I'm main clears throat*”--- you took your flu shot this year right",20140315,maryland,1,0
35584931,we've given 80 flu shot nowadays what are you waiting for want us to come to your office just give us a call http://tco/juttmnighv,20140917,Ohio,1,0
88602398,yep I'll have the flu in a few days hydrogenate's notthetypeofshoyiwanted,20140929,,0,0
211887393,rt Phoenix swine flu cases on the rise AZ health officials recommend getting flu shot now http://tco/d2pxhwe7ro foxing h1n1 http…,20140103,Arizona,1,0
508953187,rt controversialists the one downfall approximately my mom being a nurse is when she says she's coming domestic with a surprise it's the flu shot😩,20140926,Ohio,0,0
18284248,sunflower lovestruck Ty we got our shot so far so good there have been some people here get the flu when they had there shot,20140109,texas,1,0
14611587,i could be wrong businesspeople get flu shot that causes just a small bout of flu 2 a flu epidemic starts people get better repeat cycle,20141007,,0,0
26227331,my Dr's apt is at the same time that the school district gets their flu shot,20141009,California,0,0
36508315,nurse who refused flu shot wins lawsuit against Hackett regional medical center http://tco/v6ntbyfgce via @lehighvalley,20140609,Pennsylvania,0,0
147344047,free flu shot for entertainment industry members Tagore http://tco/byfn3s7mqm,20141114,California,1,0
25357270,Annecorinne good i get heartburn a lot from all the spicy crap i eat ll I've been sick the final few days from the damn flu shot it suck,20140927,Minnesota,0,0
165880894,Shelton merchantability wait are you glad you did avoid the flu shot sorry to but in,20140124,North Carolina,0,0
297594484,ad h1n1 flu is particularly harsh for pregnant women the flu shot safely protects these women from flu getaway http://tco/qtly1f1znv,20140213,Michigan,1,0
211200869,rt @lchc1: flu shot given at lanai senior center next Wednesday 9/24 at 10a call us we make domestic visits 808-565-6919 x 121 http://tco…,20140918,Hawaii,1,0
20906797,"""@airjosie: just got a flu shot but i feel like they gave me Ebola http://tco/nza7tcs2js",20141006,Florida,0,0
543812075,well got an impromptu flu shot guess it paid off to be chatting with the nurse after school ll,20141024,Indiana,1,0
14750451,making small talk with the person giving you a flu shot gt,20141128,Wisconsin,0,0
20264383,rt @msdh: the number one viral killer in Mississippi and the us is not Ebola or retrovirus or west line it's flu flu shot http://tco…,20140924,Mississippi,1,0
349969861,@junior_miller Gordon Georgeanna e i got my flu shot and voted feelingness,20141104,Texas,1,0
245605868,bandied on each arm flu shot and tap for baby Woodward imaginable grapeshot http://tco/afjynhf8od band http://tco/qtnmetl23b,20141001,Texas,0,0
351346221,rt @du_hcc: Denver understudies students have you gotten your flu shot stop by the discolor bridge nowadays'll get it for free http://t…,20141008,Colorado,1,0
85354379,“@wtvm: number of flu die in Georgia doubles in one week http://tco/j4fk4sew9o” and this is why everyone should get a flu shot,20140111,Georgia,1,0
40782375,my kind of flu shot 😉 flu flu shot liquor rum vodka Titos absolute gin captaincy bacardi… http://tco/owfajs3qkw,20141024,Louisiana,0,0
14589088,ugh just getting over my crap and now the mother and the middle brother have it next year we're all getting flu shot,20140108,South Dakota,1,0
14191979,cu faculty staff Tampa students e you can get a free flu shot on 10/8 10/20 11/6 11/20: http://tco/cmvehtzzcw please rt getaway,20141003,North Carolina,1,0
255245279,Marybelle aha yore right have to see whether Brennen gets sick or whether her flu shot was for the strain i have hope so buzz I'm depressing,20140101,Ohio,0,0
415563984,rt McDonnell currently reading could you be fired for refusing flu shot http://tco/1bkrtqsajd,20141015,District of Columbia,0,0
269159136,rt nowadays'll free flu shot offered Tuesday http://tco/t0lupqh71s,20141216,Illinois,1,0
380454657,currently 19 and wishing my mom was at the doctors office with me holding my hand while i get my flu shot,20141119,Massachusetts,0,0
54202455,rt @thehoya: editorial getting a flu shot makes the hilltop healthier as a whole e http://tco/9mkkpw7l0p,20141011,Texas,1,0
41047638,why did not you get a flu shot because man it's the gov injecting us with stuff to control our minds loofah fagot,20140318,Ohio,0,0
32980865,umbrella in honor i got my flu shot at public no fun without you but not the worst part of my day,20141015,Alabama,0,0
378350595,I've longways had a thing approximately needles why did not i know approximately flu shot as a nasal spray before now that was amazing happy dance,20140929,,0,0
474147581,is not the point of a flu shot to ensure you do avoid the flu or did i miss that little tidbit of information,20141209,,0,0
708297793,flu shot 💉,20141006,Georgia,1,0
532298350,waiting here at vs to get my flu shot,20140912,massachusetts,1,0
31465348,rt superheroes your flu shot might ineffective -- but you should get one besides e http://tco/1fhnsm44kq via http://tco/8b2oxb5xt4,20141205,Kentucky,1,0
1360825291,Tuesdays that's no good :( did you get a flu shot and still catch it this early onset of winter is going to spread it around get well,20141120,Michigan,0,0
25968397,rt @bjmquinn: thought for a Friday afternoon get a flu shot on your way domestic from work nowadays perspective,20141017,Massachusetts,1,0
17901961,“@shawnhindriix: Kendrick Lamar make music for niggards that get flu shot” am,20141111,South Carolina,0,0
176983204,thanks to sawbones i got my first ever flu shot yesterday you guys are convincing,20141118,North Dakota,1,0
25776422,got ht free flu shot thank you temple,20141009,Pennsylvania,1,0
189193922,rt anecdote free wellness screenings and flu shot at the buffalo auto show dates and times at http://tco/kgo3b0sb2q,20140206,New York,0,0
67088479,patiently waiting to get the flu shot,20141104,Florida,1,0
35179764,my mom tricked me into getting a flu shot by telling me that she was taking me to get food😑,20141029,,0,0
292444410,my mom just promised me a Victoria secret bathing suit whether i got the flu shot hate needles takinonefortheteam 😏👙👌,20140115,Michigan,1,0
26757944,flu shot tomorrow 😅 bitter sweet cos it helps but i do reject a shot,20141125,utah,0,0
87141470,tuber tests bringing flu shot to your door disservice pap tuber inst content sticking to the world of tax http://tco/lrodtnvdma,20141023,,0,0
50380592,flu shot has me like 😴😴😴,20141029,Kentucky,0,0
14502340,Mandelbrot and do remember your flu shot this year,20141005,Florida,1,0
15150378,there's is mutated strain of the flu floating around that's immune to flu shot 😩,20141221,California,0,0
53153219,panel flu spray better than shot for kids when it comes to flu flu shot a federal panel says a squirt in the http://tco/alekpkwvio,20140625,Arizona,0,0
9265982,whether i never hear the words flu shot it'll be to soon for me pharmacy life pharmacopoeias pharmaceutical,20140116,alabama,0,0
14316190,"rt @xxx_luca: ""@drpdedfred2010: @xxx_luca that's one of the best things approximately divorces…it's like a flu shot but for criticism ll",20140721,California,0,0
35043948,get your flu shot join tom O'Connor and me in getting your flu shot we did at Dahl w Sarah reflect http://tco/8erurattu8,20140118,Iowa,1,0
263491439,the flu is poor this year and hitting young adults tough many are ending up in ICU so important to get your flu shot 💉,20140104,Michigan,1,0
345160703,I'll get piercings tattoos but when it comes to having to get a flu shot I'm such a baby 😩🙅,20140115,Missouri,0,0
15749128,52000 people die of flu related symptoms final year get a flu shot Shep smith https://tco/z7nvj8pcqe,20141015,Maryland,1,0
15169671,Fredrika @derekkaplanart rarity flu shot of a beautiful man :),20140503,north carolina,0,0
221829300,i am not a fan of flu shot but whether you really think you must get it mercury flu shot options http://tco/viuyvm1aaf,20141022,New York,0,0
302617825,the flu flu shot shot form will be sent domestic with students Tuesday they must be returned by Thursday,20141020,missouri,0,0
118547689,@rungiarun @drmommycalls both my kids got the flu mist final week so much easier than shot,20140917,new york,0,0
23503882,more people die each year from the flu than Ebola in its history but people want to stop air traffic from Africa and will avoid a flu shot,20141010,Alabama,1,0
16208086,flu shot at t2857 with Emily thanks for keeping our team healthy insupportableness http://tco/enhxdi9o1m,20141003,Washington,1,0
17521364,malicious i got my flu shot two weeks ago and i still have it good luck,20140301,California,0,0
10483962,marshallings get your shot or whatever you have tit is flu season,20141210,alabama,1,0
250338854,wait my flu shot covers Ebola right,20141016,Tennessee,0,0
370426366,morning roundup con ed sets new winter usage records city urges parents to get flu shot for kids Tampa more news http://tco/5xoeei52pr,20140109,New York,1,0
15937168,Ted shaw with the hospital organization recommends that task force strongly encourages flu shot,20141023,Texas,1,0
286671692,@sanagkmel i know few people got their babies flu shot and the next day their baby is sick,20140125,California,0,0
39401810,got my fleshpot from project juice ☺️🙌 thanks for all your biological compressed deliciousness @… http://tco/sri0qtyljl,20140424,California,1,0
783328344,@kainoelle0417 i know girl i know my mom wants to get me in for a flu shot tomorrow 😖🔫,20140205,Florida,0,0
487195297,the people freaking out approximately Ebola are probably the same ones who refuse to get a flu shot,20141026,West Virginia,0,0
930089666,we are having Walgreen come to the clubhouse this Friday from 3-6 pm to supply flu shot at minimal cost for those are wanting them,20141013,Tennessee,1,0
17477336,best way to take the edge off taking the kids for a flu shot taking them to get their teeth cleaned right afterwards,20140909,Hawaii,0,0
53738452,flu shot 💉😒,20140926,California,0,0
319849098,rt Fredericka john is mad at me “@jbow69: Fredericka dot get a flu shot Boniface idiot you are do not spread it to others gap you cou…,20140109,California,1,0
56287989,you can still get a flu shot we have flu shot available http://tco/z2qtwtwyut,20140204,illinois,1,0
50279223,Cynthie we got our flu shot ouch 💉💉 http://tco/rf1gy0kaes,20140919,California,0,0
718417872,whether you are in the fort Wayne area sendd the flu shot read on approximately a clinic offering free flue flu shot http://tco/d3hxpoitp6,20140121,Indiana,1,0
87742136,a flu shot is the best protection against the flu to find a flu shot provider approach you head here http://tco/utlcjwocwx,20140919,Alabama,1,0
843845899,bewildering almighty same here but I'm blaming the flu shot i got nowadays,20140110,New York,0,0
147763423,my brother and i went to et flu shot nowadays and when my brother went the doctor came running out saying he needs you 😂😂awe what a ll baby,20140111,Washington,1,0
144723483,flu shot urinalysis and a PST happy birthday to me 😂,20140921,,0,0
805336999,free flu shot at work turndownforwhat,20141028,Indiana,1,0
48573035,@sarahkliff i got a flu shot,20141006,,1,0
473416565,Orinoco gripe yo es toy Pensacola en el flu shot nun ca lo ice we ch opines ASL respect,20141124,Florida,0,0
171098234,from good day win benefits of a flu shot http://tco/jt4u1ars8e,20141113,Wisconsin,1,0
538573202,thinking of getting the flu shot we've got the 411 on who should Tampa should avoid the flu shot on hairstyle e am,20141110,New Mexico,0,0
510570222,Corinthians blessedness holy spirit thank you for my flu shot may you keep everyone covered who was ministered the flu flu shot,20141030,maryland,1,0
40949746,Ellison did you get a flu shot this season,20141008,,0,0
25376592,on my parent's health insurance just a few days longer who wants to skydiver onto a bed of flu shot with me,20141001,New York,0,0
172786867,nowadays is flu shot day which is no problem because i do not intellect getting shot at all grapeshot Barquisimeto no biggie,20141027,New York,1,0
39904945,flu shot injury law what is sires and can it be caused by a flu shot flu and tetanus shot are often injected into http://tco/f2zdzezjif,20141125,Wisconsin,0,0
25232739,go my flu shot nowadays hope it works,20141023,Michigan,0,0
507261391,Wellesley thanks for the convenient flu shot,20141107,Massachusetts,1,0
35757699,Peterson i canceled a massage because my flu shot arm might hurt e I'd rather stay domestic with wine winter,20141113,Utah,0,0
15013580,on a scale of 1-10 how pathetic would it be to call my mom and beg her to drive to lex so she can hold my hand while i get my flu shot,20141007,Kentucky,0,0
198586296,just got a flu shot all by myself adult,20141219,michigan,1,0
436996770,Hellenization hope you feel better soon n you will be missed hope you got your flu shot,20140124,Ohio,1,0
531264945,rt @davehwsb: I'm calling you a wimp Sieglinda flu shot do painless look how tough i am http://tco/jvthdgidoz,20141022,Georgia,1,0
587463836,Holman instead of getting a flu shot i just saved time and got the flu shout out to vomit comma the concept,20141024,,0,0
23066956,after nowadays's shenanigans i think i need a fleshpot,20141012,Pennsylvania,1,0
391673763,need a flu shot pat walker health center offers a Walkman flu shot from 3-5pm every weekday ark yourself,20141016,Arkansas,1,0
284346128,@jlynn153 greatness flu games final shot destroying George lark's sonics and the pick and roll duo of john Stockton and lark Malone,20140613,Virginia,0,0
772800356,my Miami vice getup ff flu shot campaign 2014 http://tco/5g3nmqm67t,20140924,Mississippi,0,0
349262236,rt Schweitzer flu season is here folks whether you have not done so already please get your flu shot asap http://tco/3qmzp3qx6k healthy…,20140130,Texas,1,0
16956735,just so you know a flu shot will not prevent you from getting Ebola thank you otherwise Obadiah for the tippy Ebola Obadiah,20141017,Colorado,0,0
56489008,rt Somerville need a flu shot the Somerville health dept runs Thurs vaccination clinics through Jan or until supply runs out ht…,20140108,Massachusetts,1,0
2858199408,still have comet a flu shot😳,20140120,Arkansas,0,0
122248056,rt @billdeblasio: remember getting your flu shot is not just good for you it's good for everyone around you http://tco/ftnh0sweot http:/…,20141030,New York,1,0
24627889,rt multifamily it's never too late to get your flu shot at lea wood family care flu kc http://tco/bl4nprdsua,20140211,Kansas,1,0
62462057,the mesa county health department is offering flu shot in the DE bequest and coll bran areas this week http://tco/er0dr0azfz,20141117,Colorado,1,0
42310826,get a flu shot from Sammy Sosa http://tco/k90hyywxug,20140315,Georgia,0,0
629671347,bout get this flu shot 󾌴󾌴󾌴,20140911,,0,0
11008102,dear silly millennial stop snap chatting and snorting adder all for two seconds and go get your flu shot XOR Ben http://tco/b1gyjrslno,20140127,New York,1,0
50365566,a healthy team e a happy team 1144 is already at 2 flu shot clotheshorse Detroit Benedictine http://tco/aniopcryr6,20141001,,1,0
29802985,people act apologetic asking for a flu shot now and fairly frankly they should it's January for crying out loud,20140110,Arizona,0,0
284226589,rt carpetbagging who else got their flu shot http://tco/b5diqfiz0w,20140721,kentucky,1,0
442555681,whether you know anyone in Canada tell them to get their flu shot now its seems issues at a flu flu shot production http://tco/ojk0dpa3mm,20140912,minnesota,1,0
30924802,like this post whether you have already received your flu shot this year the benefits the flu flu shot can supply http://tco/yzlknruiy8,20140109,Indiana,1,0
67799625,reinsurance is offering flu shot at their booth until pm est for $15 and are available first come first serve closed 12pm-1pm),20141018,Indiana,1,0
551345722,rt Wilkerson so whether you could get an Ebola flu shot would you yes get your flu shot people it kills more homes than Ebola,20141004,New York,1,0
862496382,minuteness job search Rn's for seasonal flu shot project at nova medical centers Knoxville find this job&amp;more http://tco/nywhv1j34i,20140619,Tennessee,0,0
20471329,birthday shot before work this morning because i work at a hospital and flu flu shot are mandatory see what i did there,20140925,California,0,0
411186904,stop in nowadays from 4-7pm for your flu shot rite aid is in the fit lobby and will bill to your insurance http://tco/gvanhwrcuf,20140909,Maryland,1,0
1609027698,everyone come to supercooled Halloween from 11:30-1:30 free flu shot and ton of informative booths Halloween,20141031,ohio,1,0
15625138,guaranteed more people in this country will die of the flu this year than Ebola getyourflushot,20141018,Pennsylvania,1,0
188785680,got my flu shot nowadays hopefully no flu for me this year 💉🙅,20141030,Illinois,1,0
222541423,@jamey_giddens lord quarantine yourself get a flu shot next year,20140113,Illinois,1,0
8036532,the flu ends with you get your free flu shot at oohs now through Friday Jan 24th from am until 4:30pm,20140123,Wisconsin,1,0
377329652,cedar ridge family medicine is ready for you flu shot and treats http://tco/yudwe7zy8t,20141007,Utah,1,0
891083828,this happy super girl just had her flu booster shot and is still giving out smiles though you can see… http://tco/5ldtdmxp86,20141212,new jersey,1,0
728469158,nothing says welcome domestic like a finger prick 2 tubes of blood drawn and a flu shot,20141128,massachusetts,0,0
529094547,legionary did j not pay for flu shot i do avoid this,20140419,Massachusetts,0,0
287901039,kid natural on flu shot http://tco/wxosoterjz,20140917,Minnesota,0,0
208205144,flu season is here please encourage your students to wash their hands often have you had a flu shot it's not http://tco/3ibwwn623g,20140116,texas,1,0
26092878,من يوم ما اخذت ال flu shot وانا مزكم احس اني انحقنت بالفيروس مو بالمضاد,20140101,Pennsylvania,0,0
465706259,i liked a tuberous video from transcribes http://tco/gexhicl8p3 mandatory flu shot flu shot imposed on nurses and tin foil hats,20140109,California,0,0
283765656,rt @hea201_sbemisda: skip the shot new flu shot patches could come in the mail http://tco/ttcncvpotk @hea201_spring14,20140308,North Carolina,0,0
125698355,got my flu shot nowadays Republican is getting hers right now you should get yours too,20141126,New York,1,0
824383052,i feel like i should have sprung for the flu shot,20140115,California,1,0
789980540,rt @genevaswans: sooths 12 people have die from the flu in alacrity Andi have cometten a shot yet,20140114,Florida,0,0
288022308,maltreat brush that's my hospital am i got get my physical and flu shot in a couple weeks smith,20141203,Massachusetts,0,0
267717712,wondering should i gone n get this flu shot,20141014,Mississippi,0,0
267918879,got a flu shot before work i swear every single one of these people have hit it thanks,20140919,California,0,0
22710773,i do reject to go to the doctor in the morning😒 mi salty Cleveland have mandatory flu shot😡😡,20141014,Ohio,0,0
574444657,a mother’s flu shot nightmare – unedited version e family health freedom network http://tco/srow9qwlb2,20140215,,0,0
25138311,got my flu shot appaloosa healthfully,20141001,Tennessee,1,0
12640682,but what's inside the lollipop you get after the flu shot rt wired what's inside a flu shot http://tco/hdtnvb0m3n,20141103,Massachusetts,0,0
155186645,Elizabethan did you get the flu shot,20140127,Florida,0,0
306438305,flu shot keep kids out of hospitals http://tco/08wlbixytb,20140325,Connecticut,1,0
16243550,rt Jamie whether you have cometten your flu shot this year you are forbided to complain on the INTERNET approximately Ebola,20141016,Ohio,0,0
19312573,according to my mother i am sick too often therefore i need a flu shot lucky me sick kid,20140104,Texas,1,0
447362087,Steven and i just did Christmas eve shot of Nyquist cold and flu syrup Christmastimes,20141225,South Carolina,0,0
150784080,breaking NC reports first child flu die this year an infant in the eastern part of the state die nowadays baby was too young for flu shot,20140113,North Carolina,0,0
212251129,free flu shot clinic nowadays am to 12pm at the alternativeness information Tampa referral center e spectrophotometer lower level,20141128,Arizona,1,0
25162950,free 5 gift card with flu shot at mart http://tco/wx9g2kdmsp freebies free stuff free free sample,20141006,,1,0
855703604,oops getting flu shot steroid for knee anti inflammatory eds and god knows what else getting old sucks,20141113,South Carolina,1,0
96043973,rt @2real2beyou: this trucking flu shot they gave me tho &lt; bitch still swollen gunship gt,20140128,Louisiana,0,0
149575548,got my free flu shot nowadays feeling totally wonderful and fluoresce,20141218,Tennessee,1,0
622232539,flu shot injected Santa hat obtained for Santa v Martians photo shoot car packed for rehearsal and one more day lit thriving emptiness,20141120,Texas,1,0
494820943,I'm the only person in the clinic in town and yet i been sitting here for 10 minutes for a flu shot,20141028,Virginia,0,0
17160436,flu season is hitting young people harder this year because they're refusing their shot http://tco/apc2zltymq,20140116,,1,0
268051096,swineherd flu is common this year but a flu shot can protect you http://tco/f3rr2ynbi4,20140103,Oregon,1,0
97231762,whether you did avoid a flu shot yet get one e first flu die reported in Boston http://tco/2gnl6owael,20140110,Massachusetts,1,0
18810719,live on long island hope you got your flu shot here's why http://tco/yt6jyrgcsc,20140108,New York,1,0
313655135,flu shot nowadays http://tco/6sy7curzwe,20141023,Texas,0,0
478902505,i added a video to a tuberous play list http://tco/u6rzb1mewc brother trolling sister's flu shot,20140922,texas,0,0
34990384,whether you are reading this you should get a flu shot make an appointment at my health to get yours call 952-474-3251 to schedule one nowadays,20140917,Minnesota,1,0
25084676,i do overstand how people get piercings all over their body's like i can odd get a flu shot without a nurse holding me down😳,20140804,Iowa,0,0
215692667,time to suck it up and get my flu shot,20141118,New York,0,0
792676,rt chicory free flu shot nowadays in Chico http://tco/kysqghv8nv,20140122,California,1,0
820892052,emblematic is doing their live stream right now while I'm getting my flu shot sigh ):,20141107,California,0,0
9275972,pharmacist told me my ins plan came w free flu shot so i got mine nowadays Thanksgiving flu shot http://tco/20rtatjall,20140819,Pennsylvania,1,0
752374123,every time i volunteer at children's hospital i think i should become a nurse then i remember i tear up when i get a flu shot perhaps not 👶,20140205,North Carolina,0,0
145369616,everyone's buzzing approximately flu season tough to believe it's nearly here again McGovern says get a flu shot in October http://tco/7x3xnam8wk,20140904,North Carolina,1,0
627098814,ya it's flu shot season e said no one ever nope I'm a big fan of the free flu shot at work it really works,20140916,Illinois,1,0
89074675,doggone as someone with the flu at this very moment… 1 to getting the flu shot always,20140805,New York,1,0
286943890,smiley 7 wash hands flu shot plenty of fruitlessnesses and sleep sugarfreedyefree,20141030,Minnesota,1,0
208834451,rt @emv52: prevention help upward Bethany @grouchomama718 mt @felixwortiz free flu shot wed10/29 at 404 55th st http://tco/exiiumyjgj,20141022,New York,1,0
257123540,rt guillotine i get a flu shot while learning why we should all do it http://tco/flhwylzhot @wjbf http://tco/nelqdskcle,20141011,Georgia,1,0
127583486,weekly email newsletter flu shot this Saturday at center get spirit day ribbons on line or center e http://tco/ry0phf0cmf,20141001,Ohio,1,0
630880279,rt @topaz006: it's very important that everyone get a flu shot this year so i do not have to,20140902,Colorado,0,0
402844554,winter weather ready car prepped power outage ready flu shot Tampa eds on hand prep now,20141113,District of Columbia,1,0
14828860,"""@washyopussyho: my kinda flu shot 😊😊😊 http://tco/jds9hcfpqy""lol",20141028,New Jersey,0,0
29062450,rt Commonwealths free flu shot Walkman clinics start next week in our main entrance lobby http://tco/yvkd8lok0d http://tco/4ciiq4ltik,20141113,Minnesota,1,0
44673910,CDC recommends the flu shot for adults and children with asthma read more here http://tco/0lys0mgmhc,20140922,New York,1,0
2218570128,now that's a flu shot i would take Kelly jean hillman http://tco/4mzw2cparc,20141026,Indiana,0,0
25152483,acknowledger never too late to get the flu shot,20140419,new jersey,1,0
18756512,@tha_homie_homan I'm gonna get a flu shot when i get back tho Ur like the 4th person i know that has that shit ll,20141207,California,1,0
50510287,why even healthy people should get a flu shot to protect your grandparents http://tco/qtczmzzjic via @voxdotcom,20141027,California,1,0
790402693,i nearly punched the nurse at work because she gave me the flu shot p ll,20141016,New Mexico,0,0
2167615663,rt @phlpublichealth: flu is no joke get your flu shot rt @jeffskversky: fillies b chase Huntley was sent domestic from the ballpark nowadays wit…,20140408,pennsylvania,1,0
