user,tweet,date,state,takeFlushot,negativeFlushot
253305925,unfetchable the same way Christians do give flu shot because they think it makes them sick and its intellect control,20140623,texas,0,0
240375410,everyone is sick around here yuck taking bubs to get his flu shot this weekend,20141001,hawaii,1,0
45914218,rt @drjmob: @sarahkliff goes to healthiness to get a flu shot from a pharmacist during American pharmacists month http://tco/vgpvbdbims,20141008,Maryland,1,0
455086314,spiritedness did you get your flu shot,20141017,Florida,0,0
1674195842,forgot to get my flu shot before i left on vacation gotta stop by wellness before i go domestic nowadays,20141202,Virginia,1,0
37714022,Walgreen will be offering flu shot at the step out walk on Saturday thank you stay healthy,20141015,New York,1,0
99843490,rt provability Pensacola VA nurses will give free flu shot to veterans at veterans memorial park 9-11:30 am on Nov 11 vets day http://t…,20141103,Mississippi,1,0
16619708,lady just got prissy at me because i did not know cs's flu shot schedule,20141210,massachusetts,0,0
17032442,i do not know how true this but i think I'll still get my flu shot this fall http://tco/mfcscwhgyv,20140408,Missouri,1,0
253353557,@nancyleegrahn i voted nowadays Tampa got my flu shot could i get a double shout out for doing my part to help this country 🇺🇸💉 thank you ✌,20141104,Texas,1,0
1435941187,got the flu shot then got a fever blister awesome,20141017,Florida,0,0
231213395,rt @paula_span: is Highlands flu shot more protective for elders new Newman study says yes but some dissent @judith_graham reports http:/…,20140904,Colorado,0,0
268548751,an hour wait surrounded by sick people for a flu shot that will take 2 weeks to be effective am i lost the logic in all of this,20140107,North Carolina,0,0
90935568,rt weathercock I've never had the flu and I've never had a flu shot are you certain you've never had it you can pass the virus on to ot…,20140116,Michigan,0,0
45993466,i have to wear this mask because i do reject a flu shot e creed moor psychiatric center http://tco/wxxqoqsn2n,20140110,new york,0,0
15381827,i think perhaps i should cometten a flu shot,20141221,Kentucky,1,0
24410734,i got a flu shot so I'm pretty certain I'm an adult now,20141028,Utah,1,0
894382722,i generally do not but nowadays i did i did it i got the flu shot my friend Judy had been pushing me for a week t http://tco/xlg2i7stcp,20140119,California,1,0
382418394,just got a flu shot at work the disease is inside me now,20141020,georgia,0,0
454084038,Vaughan did you get a flu shot,20140205,Illinois,0,0
21226405,most appropriate use of the hash tag yolk rt tailwind getting a flu shot solo,20141024,California,1,0
555689857,Short I've been down with this upper respiratory flu bug for 6 days now e and i got my flu shot in October depressing stuff,20140103,Ohio,0,0
2493054132,it's flu shot day stick it in me bf,20141016,south carolina,1,0
369804438,north coast flu die nearly double medical assistant jasmine burden left administers a flu shot to Jeremie http://tco/znzcsbddge,20140206,California,0,0
2259885283,rt @iupui_fluseason: flu shot start Monday cot 6 for all current students staff and faculty getaway flu fluxed,20141006,Indiana,1,0
15523710,just took my 3 yo to Howard for a flu shot i offered her a Donald duck sticker but she chose some frozen character she's grounded,20141002,Texas,0,0
2305785854,rt Fischer flu shot ah I'm good royals are in the lacs world is clearly ending soon besides,20141013,missouri,0,0
330088961,this flu commerce is not a joke there are young otherwise healthy people dying from it get your flu shot,20140108,texas,1,0
32399121,i finally got a cool band aid with my flu shot childbearing tweeter http://tco/mfnyn84zhb,20140127,utah,0,0
1855081970,please get your flu shot i got mine 😊 http://tco/ljanpkyg27,20140918,North Carolina,1,0
385668781,are there any vegan flu shot available,20141105,,0,0
950466966,@_l3xi Melissa go get a flu shot,20140115,michigan,1,0
257683906,great news you can now get your flu shot in path mark http://tco/wikefu5rqz,20141125,New York,1,0
17865214,"“@briannewcbs: to celebrate Dallas being ""ebola-free"" tomorrow how approximately we all get flu shot”",20141106,Texas,1,0
17065517,got a flu shot slept all day very productive,20141010,California,0,0
25601845,I'm never forgetting to get a flu shot ever again,20141223,New York,1,0
14669951,get your flu shot people it's going around parasitically,20141115,Florida,1,0
65251498,Albertina flu shot 😉 certain why not,20140323,Florida,1,0
245070596,i did not just vote nowadays i also went and got a flu shot thinking society owes me big time,20141104,Arizona,1,0
310356989,how ironic that i keep forgetting to get my flu shot frontward,20141016,Indiana,0,0
2575516026,should you get a flu shot…or not cinematographic http://tco/umtnlrct11 flu health influenza fitness work,20141020,Illinois,0,0
372520997,who got their flu shot nowadays this girl,20141013,Kentucky,1,0
1007496565,did Walgreen just put a adhesive bandage over Africa during a flu shot commercial epidemiological wrong Stillmann,20141005,Ohio,0,0
1581191983,tuber will deliver a flu shot to your door nowadays http://tco/wpekqdrwoz via e,20141023,District of Columbia,1,0
432944454,being sick is the worst i got my flu shot for a reason why,20140126,maine,1,0
340448211,remember to get your flu shot Marin health officials urge public to get vaccinated before flu season http://tco/hzwyshbk9e,20141110,California,1,0
58939366,rt Lugosi everyone 6 months should get a flu VAX way to go bill Nye mt prescience got my flu shot you should too http://tco/w…,20140828,Michigan,1,0
14217846,@whydoisay macaroni is fucking amazing i was looking at my paperwork and realized i get free flu shot threw kaiser d,20141124,California,1,0
49983680,still need to get a flu shot get it at Cliburn on Wednesday October 29th from 2-4 pm,20141026,Arkansas,1,0
514434748,21 years old and just made my mom come get the flu shot with me 😬,20141027,Michigan,0,0
26460275,whether you have not had a flu shot they are available at many pharmacies Kroger and Walgreen for instance on a http://tco/jjsl9btnvx,20140113,Arkansas,1,0
74374895,Springsteen hope you get to feeling better soon also hope you got your flu shot,20140114,Tennessee,1,0
191672229,grateful that i got a flu shot and don’t have the great flu it’s wiped out my wife,20140121,california,1,0
78000590,county encourages flu shot with free event Sandie http://tco/uvgiyz2z8a,20140927,California,1,0
424525062,rt princess got my flu shot 😊💉,20141008,Texas,1,0
1486363447,Jeffrey demoralizer on a side note did you get a flu shot this year,20140208,Connecticut,0,0
1038985280,students can get free flu shot nowadays at the healthfulness from 9am-4pm while supplies final http://tco/arf8gywrx2 cf,20140124,Florida,1,0
471233973,it's flu shot clinic at school nowadays sew my needle senses are on high alert domestication no shot,20141015,Oklahoma,0,0
123441658,flu shot 😒,20140117,illinois,0,0
285335358,flu myths information and deal with pharmacy – get a 20% off shopping pass when you get a flu shot here http://tco/oxfsmjndum,20140112,new york,0,0
53733330,rt rollerskating every flu shot feels better with a unicorn bandied http://tco/luatckwbob,20141014,California,0,0
175622153,flu shot available at my local pharmacy signs it is nearly fall,20140815,Maryland,0,0
299864350,cool date idea flu shot,20140929,District of Columbia,0,0
616892847,rt Oregonian icy flu victims fill areawide erst 7 people have die tetrafluoride http://tco/b1e4fcnypw,20140104,oregon,1,0
721207550,“@coverthree: paternoster flu shot” as a kid i hated flu shot so much bolted doc office x forcing mom Tampa rd to look for Meredithe got me,20141218,Pennsylvania,0,0
268838330,my dad said they can take me a flu shot whether I'm still sick😭,20140126,Texas,0,0
254846785,i was not expecting to get a flu shot what,20140219,connecticut,0,0
186242638,it’s national influenza vaccination week so get your flu shot and get involved http://tco/ybgzyduyyh,20141216,Connecticut,1,0
464021788,got my flu shot for work http://tco/jjbdjip5jq,20140924,Utah,1,0
15110498,i absolutely hate getting shot but at least whether i get the flu it will not be as poor,20141104,ohio,0,0
361629225,rt @i_am_mccarter25: gotta get a flu shot nowadays 😫,20141016,North Carolina,0,0
14192656,just got the flu shot so i rewarded myself with a chocolate milkshake 👍,20140122,Ohio,0,0
1659177548,"rt shareware on the fence approximately whether or not to get a flu shot watch this @drrandymartin1"" http://tco/h8vet6w9cj",20141013,South Carolina,0,0
537788619,and to think i actually paid for the flu shot this year 😒 sh,20140517,Colorado,0,0
24898822,you miss 100% of the shot you don’t take but i never get the flu anyways so fuck it –kanye inspirational midnight,20140920,,0,0
314190053,being a big girl and getting a flu shot all by myself,20141101,Ohio,0,0
1123931600,man i really hope all these Santa's up in the malls got flu shot and wash their hands holding all them kids 😂🙈🎅,20141218,California,1,0
19915432,approximately to get my flu shot 😭😰,20141104,texas,0,0
332546690,i got my flu shot nowadays did you alwaysbebatman e rite aid http://tco/prmr3qglhc,20141015,,1,0
10424112,rt @thejessicajames: fever and the flu unpleasant y'all get your shot please,20140125,massachusetts,1,0
972879421,Farleigh cold since Sunday good thing i got my flu shot Friday,20140122,Indiana,1,0
30606821,Ebola enterprising season flu Tuskegee syphilis experiment,20141019,Michigan,0,0
25289951,my flu shot did not totally work type a mutated but that and Tamil made this the shortest one i ever had back on my feet in 4 days,20141226,Virginia,1,0
10324292,silly flu shot 😣,20141010,Illinois,0,0
8669182,i just walked myself to vs to get a flu shot i have changed,20141102,Michigan,1,0
200219150,@ali_partlow favorite that you got the flu shot here Tampa i got to see you not favoritism the fact your going to pump your mom ll 😂hahaha,20140109,Alabama,1,0
203316009,coming up deep freeze ending paw paw standoff over consumers energy under fire for blackouts why flu shot are crucial pop quiz,20140109,Michigan,1,0
55937627,is it too late to get a flu shot 😷,20140127,,0,0
43322770,indomitableness chi la verdant we es Una Linda initiative y facileness podiums collaborate recipiency estrous flu shot en Walgreen,20140919,,0,0
2354930857,Tylenol cold and flu taste worse than a straight shot of vodka 😷,20140930,Oklahoma,0,0
14095510,Behring will again offer flu shot at no charge to employees and their spouses beginning sept 9 https://tco/3zcyax5umz,20140820,Pennsylvania,1,0
519774757,who's ready for flu season i may need a shot or two patron donation tequila fireball http://tco/nynyc9paye,20141110,California,0,0
458643790,rt annihilation rt schoolmaster nostril flu shot Tampa mist for forsythia schoolbag children on 10/15 Tampa 16 early rel for k-8) 3-6 pm http:…,20141009,Georgia,1,0
391130417,activist post record numbers line up for flu shot as media hypes the flu ‘epidemic’ http://tco/i7eecwfoav via activist,20140116,Maryland,0,0
35567599,i encourage sportswriters nation to get your annual flu shot i did nowadays teamster,20141017,Oklahoma,1,0
41235724,why you should get your flu shot now http://tco/fj1lfxwmnh,20140922,Ohio,1,0
496731382,get your flu shot and help loch Angeles county physicians prepare for Ebola http://tco/netxhkhlbc,20141015,California,1,0
222586314,dear Halloween sweet displays and flu shot commercials calm down 93 degrees nowadays,20140902,New York,0,0
508165308,flu season is coming quickly make certain to get your seasonal flu shot here are a few tips on the influenza http://tco/jg1dqmjlbt,20141021,south carolina,1,0
25448459,Walgreen should decide whether they are a pharmacy or clinic waiting 30 minutes to flavor medicine BC pharmacist is giving flu shot is no fun,20141005,Oklahoma,0,0
449085723,my mom thinks I'm a coward cuss i had flu shot this morn and it's giving me a fever sh I'm just too fragile OK,20140227,Georgia,0,0
343211837,Kroger is a great pharmacy to get your flu shot coupon,20141129,indiana,1,0
582194571,finally got a flu shot so all the germs @emily_anne441 and @e_fritzzz bring domestic daily will not make me deathly sick,20141112,Virginia,1,0
407530619,it’s national influenza vaccination week so get your flu shot and get involved http://tco/cxekocbqcx,20141210,Kentucky,1,0
249443534,rt @rccrimewatch: more people will die this year from the flu than have die from Ebola in the final 40 years tetrafluoride,20141017,Ohio,1,0
31204546,so apparently my mom says i have the flu because i did come get a flu shot,20140112,,0,0
14862775,time to get flu shot all of you fellow tweeters,20140820,,1,0
1158690294,approximately to get a flu shot I'll let you guys know whether i come down with SIDS,20140207,New Mexico,0,0
484949567,rt grimmest princeliness next year this time niggard gonna smooth be getting yearly Ebola shot right along with the flu shot,20141015,California,0,0
177803312,scarier than Ebola http://tco/zzlppilvvh really great points here right off the bat get that flu shot wear a seatbelt use sunscreen,20141016,California,1,0
26376283,“@furiousnurse: @solivagant007 Hargreaves corruptibility http://tco/pupyecq0dj” so what flu shot are not as common for children,20140918,colorado,0,0
264486126,get your flu flu shot at vs minute clinic Tampa 20% off vs shopping pass flu shot minute clinic http://tco/aspkfuwnwr,20141024,Illinois,1,0
416608047,my doctorate says the flu has hit Boston e stop watching this video and go get a flu shot http://tco/hjfgvbmfk9 via @voxdotcom,20141014,Illinois,1,0
396876364,got that flu shot ✔💉,20141107,,1,0
518117517,hey the denial of the truth will get you the flu whether you take the shot http://tco/97dhyhhmja,20141105,New Jersey,0,0
507621346,i have to get my final flu shot 😩,20140317,Louisiana,0,0
407990355,thanks to my profession I'm losing my flu shot virginity nowadays boooooooo,20141021,south carolina,0,0
350004554,been a nice inside kinda family day with the minus the 11/2hr excursion trying to get flu shot now it's http://tco/0xuqhnxoqz,20141013,illinois,0,0
76636688,come down to Packard nowadays to get your flu shot from criteria 10-2 in the garage http://tco/qquyzm2dhk,20140916,North Carolina,1,0
114501229,rt @dame_dna: students stopped me and rd b after lesson to ask approximately Ebola great convoy our advice do not panic go get a flu shot instea…,20141003,Oregon,1,0
627868558,flathead county hosts flu shot clinic dispelling e the flathead countability health department held its annual mass… http://tco/xn7ukrmmc4,20141009,Montana,0,0
403902055,Byronism quit worrying approximately Ebola famed final words i get the flu shot tell me where i can get the Ebola shot,20141015,Pennsylvania,1,0
69727316,Brigham and women’s nurses sue over flu shot mandate http://tco/tkhxilybxn via Bostonian tea party cot lot GOP,20140925,New Jersey,0,0
230903178,definitely getting sick moment time this winter giving in to the flu shot i guess,20140108,New Jersey,0,0
985531734,gets flu shot for first time die of dysentery,20141209,Mississippi,0,0
66517643,was in the car w my mom having a gr time until she gave me an evil look Tampa whipped into market street Tampa said our get Ur flu shot trustiness,20141113,Texas,0,0
133218260,common myths approximately the flu shot are put to rest at 5:15am on morning @wkbw eyewitness,20140925,New York,0,0
40034188,everyone get their flu shot,20140114,north carolina,1,0
809299615,getting a flu shot by myself aka I'm a grown man,20140120,Georgia,1,0
21324595,ugh my friend MIA just lost albs she had the flu final week ialreadygotmyflushot iguessitsthegym and eating right for me😑,20140424,,0,0
407396035,feeling sick and can not sleep whether i have the flu from that damned flu shot i will freak 😖😤😩,20140204,Oklahoma,0,0
393136721,rt Delawarean 31 days to a healthier you get your flu shot nowadays healthful flu activity is increasing across the us http://tc…,20140111,Delaware,1,0
32411178,quarantined with a sick little guy first virus of the school year just as i was approximately to take him to get flu shot http://tco/ocw6xwcgia,20141011,Florida,0,0
32151090,got my flu shot nowadays nicely painless,20141107,California,1,0
351982406,@toledopotslady what are potential problems with flu shot and days oh BTW lived in Toledo from 2000-2012 love that city,20140116,Virginia,0,0
169994336,happening now get your free flu shot nowadays http://tco/me5sitn46w cowbird,20140927,Tennessee,1,0
14837862,thanks telemarketing for holding my hand during my flu shot http://tco/yglgwgntjj,20141014,connecticut,0,0
20246675,rt @layne_flake: to help fight Ebola in the us get a flu shot http://tco/0umywm5sog,20141030,Georgia,1,0
52646125,WI commerce news retailers giving more flu shot Walgreen if enough flu shot final season to protect a http://tco/xvbe27hx8l,20140918,Wisconsin,0,0
14188287,flu shot day here at care stream 😩 (@ care stream health cafeteria in Rochester Nye https://tco/rgcnfujlrs,20141006,New York,0,0
32823,flu shot check touchiness,20141118,tennessee,1,0
759911647,rt @endhasarrived: we're going to bed now my nerves are shot i mean rabies e 3 different flu strains have joined to create a new killer …,20140221,California,0,0
48197687,yeah mom of course i wanna go get a flu shot not,20140115,missouri,0,0
177022336,rt Prague the flu is coming Bangor health Tampa community services has shot for 15 bucks get em while they're hot at 103 taxes ave,20140108,Maine,1,0
2153650939,this better not be the flu butigotmyflushot,20140209,New Jersey,1,0
28148762,“@ohhhhkill_em: i generally do avoid up until 8:30 on Fridays but my mom just had to schedule my flu shot at 8 dint she”firstworldproblems,20141017,pennsylvania,0,0
518896953,it’s national influenza vaccination week so get your flu shot and get involved http://tco/wdohqixyeo,20141211,Illinois,1,0
40492670,silly flu shot -_-,20140121,indiana,0,0
1654146570,rt furtherance DE blastoff get a flu shot already so you can stop worrying you have Ebola when you do not,20141024,New York,1,0
259459187,i have to get a flu shot tomorrow morning tho,20141017,,0,0
473073077,i got my flu shot so i better not be getting sick😣,20140210,California,0,0
22285792,rt @chris12news: do u actually have the flour something else when should you go to the doc too late for flu shot answers at 6:30 @12n…,20140127,Arizona,0,0
1963986066,Christmastimes @lilmysninja i used to get seasonal allergies but have out nearly 2 full years thanks to recoverability no flu shot either,20140524,Massachusetts,0,0
304739992,@taaylerrrae do not you always get flu shot in your arm do forget the final time they gave me one in my hamstring,20140928,Ohio,0,0
42228255,mum has recovered from the h1n1 she wants to remind people to get a flu shot because the flu sucks and it can kill you,20140208,California,1,0
56879674,birch will be offering free dental screenings physicals and flu shot on Saturday February 22 at the roman family place on main street,20140206,North Carolina,1,0
277490691,can not believe i just voluntarily drove myself to get a flu shot i need to find something to do,20141109,tennessee,0,0
23263924,are you getting a flu shot http://tco/vlxkjwksjs,20141106,Texas,0,0
318006858,rt Oregonian legacy offers free flu shot in Portland area for everyone on veterans day http://tco/2zf8jpvsvs,20141111,Oregon,1,0
104485675,@ladyz_712 gyroscopic springtime totemic discoloreds goddess flu shot only boost Ur immunity by 9 Tampa there's so many types of flu,20141103,Oklahoma,0,0
442067780,flu shot and blood draw in one visit shit is unpleasant http://tco/hxcm47kfbh,20140212,California,0,0
745583538,amen wash your hands and get your flu shot//scarier than Ebola via daytimes http://tco/bbztr5ksac,20141016,District of Columbia,1,0
14606098,free flu shot http://tco/9yzgmwzvt4,20141001,Missouri,1,0
30846271,rt @vabvox: whether you live in the us Tampa haven's gotten a flu shot ls do it's not just approximately you refusing flu it's bat you not spreading …,20140111,New York,1,0
341469919,@forganysarah heard your news cast on the flu this morning i guess it can be pretty serious got my flu shot final month,20140110,,1,0
186353713,just got my free flu shot flu flu shot immunization healthfulness protection nurse selfish http://tco/ncjoj2yfw8,20140128,louisiana,1,0
29708449,i am 19 and i am scared to get my flu shot at Walgreen by myself,20141120,Illinois,0,0
41597502,ended Christmas with the flu psychedelic should not have gotten that free shot 😷,20141226,california,0,0
195093267,flu shot nowadays 👌 wish they had an Ebola shot i could get too 😷,20141016,Alabama,1,0
82431362,y'all get your flu shot,20141017,Georgia,1,0
32245557,it’s national influenza vaccination week so get your flu shot and get involved http://tco/jn6plnrirs,20141213,Michigan,1,0
1064726928,got the flu or are you in need of blood got o positive blood I've got it in spades Tampa my white blood cells are armed with shotguns,20140201,kentucky,0,0
2296233758,just got my 1st ever flu shot haven’t die yet so i’m doing OK i suppose,20141017,,0,0
61838410,vitamin d is your alternative to a flu shot and good for many other debilitating illnesses http://tco/oqkhwtbflf,20140111,vermont,0,0
42633389,rt @akram_boutros: I'm doing my part to protect my community please make time to get your flu shot focused http://tco/krh6wxe53y,20141104,Florida,1,0
187239845,should not listen to @laurrrrrr12 when she told me to get the flu shot 😩😔,20141209,Wisconsin,0,0
1167517764,Tampa i had a flu shot,20141219,texas,0,0
301842874,rt etherealness @fukyour_bae i had to get some test and flu shot nothing major thanks for caring,20141014,New Jersey,0,0
989579203,so you're bitching approximately getting the flu shot try being diabetic thatshitpissesmeoff,20140107,Alabama,0,0
38539327,do you get the flu shot do you think it works how do you fight the flu can you avoid getting sick backtalk,20140103,Oklahoma,0,0
17516403,Campbellsport @alikapty17 ll i just went for a check up and a flu shot there's nothing wrong with me,20140930,Pennsylvania,0,0
19728397,undeliverability tuber wants to give you a flu shot would you let them http://tco/0wemmkjp8h via Forbes,20141110,California,0,0
284298422,@bree_mars @buddy_faro perhaps I'm just lucky I've been getting flu shot annually in octagon for ages final flu i caught was in 95,20140119,New York,1,0
14134026,try centralize -- they restocked http://tco/plb6tx5lzw rt misalliance tried again to get my son a flu shot nowadays -- no luck vs was out,20140127,Florida,1,0
1881751982,got that flu shot out of the way get at me flu i int curred,20140110,California,1,0
46410667,what whether flu shot has a microchip that ruins my augments,20140109,Florida,0,0
553038849,i need get this flu shot,20140914,new york,1,0
191720774,rt freemasonry get your flu shot folks flu season worsens in SW Fla 20-50 age group affected most http://tco/j7ujpvokdh,20140129,Florida,1,0
13638642,Charlena flycatcher @cdiow @julie_pogo @puepi_232 @jjjules14 got the flu shot i am happy,20141009,Missouri,1,0
38313707,flu myths vs facts e influenza and the flu shot http://tco/jbetmo0mwe,20141124,Louisiana,0,0
1061045696,this little girl deserves an Oscar for her performance while getting a flu shot http://tco/9iyznzvj5h via Pilcomayo buzzed,20140923,California,0,0
14248784,princess Leia fainted upon seeing the intellect probe not realizing Darth Vader was following die star protocol and giving her a flu shot,20141004,Minnesota,0,0
702455576,h1n1 flu is harsh for pregnant women the flu shot safely protects these women from flu getaway sponsored http://tco/rl1ho9qgrk,20140217,Texas,1,0
452607396,i think i must have forgotten to get my flu shot final fall third time being stick in the final three months billingsgate getyourflushots,20140518,kansas,1,0
50716043,McKinney i get it i got a flu shot the other day and demanded my i was courageous sticker and requisite sucker,20141105,Texas,0,0
495378752,flu shot available at the pharmacy no appointment essential no charge with a valid insurance card,20141125,Arkansas,1,0
926621492,@boofaunit i did get my flu shot that's the worst part these kids are full of germs it's gross,20140319,Pennsylvania,0,0
69686707,anybody know how much the flu shot is,20141221,Illinois,0,0
385847731,i have never done that rt @msbunz617: just got my flu shot,20140919,massachusetts,0,0
419996145,soot the final doctor appointment Gaston had they gave him a flu shot and now he has the flu Kaylil has http://tco/fsa2luvuii,20141004,Arizona,0,0
309119095,have you had a flu shot yet do you plan to get one let us know here http://tco/jntcaldgdo,20140103,Georgia,0,0
89512769,i have to get a flu shot nowadays 😭,20141006,south carolina,0,0
479017336,@xcatlady13x will be going out hope you got a flu shot the season is supposed to routinely peak in January but it's been rough in the,20140104,,1,0
21438665,i just got my flu shot 💪,20141021,Florida,1,0
26673843,rt problematical someone called to ask whether we had flu shot sand so it begins,20140812,New York,0,0
33043779,can not wait to get this flu shot in a min 💉,20141007,Michigan,1,0
14914147,approximately to get my flu shot flu shot work,20141007,Texas,1,0
68075213,Sarajane heal told everyone she met all week that she got a pinch because that's what the doctor called the flu shot it was very cute,20141029,Massachusetts,0,0
100079816,great view of downtown Manhattan from my doctor's office earlier nowadays got my flu shot too http://tco/rdtolr28ev,20141002,New York,1,0
567545431,getting this flu shot doe tired of y'all sick muhhfuckas ban around me,20140113,texas,1,0
842952254,I'm getting a flu shot and naps for my birthday and I'm more than OK with that hahnium,20141023,Pennsylvania,1,0
