"review_id","user_id","business_id","stars","date","text","useful","funny","cool"
"VfBHSwC5Vz_pbFluy07i9Q","cjpdDjZyprfyDG3RlkVG3w","uYHaNptLzDLoV_JZ_MuzUA","5","2016-07-12","My girlfriend and I stayed here for 3 nights and loved it. The location of this hotel and very decent price makes this an amazing deal. When you walk out the front door Scott Monument and Princes street are right in front of you, Edinburgh Castle and the Royal Mile is a 2 minute walk via a close right around the corner, and there are so many hidden gems nearby including Calton Hill and the newly opened Arches that made this location incredible.  The hotel itself was also very nice with a reasonably priced bar, very considerate staff, and small but comfortable rooms with excellent bathrooms and showers. Only two minor complaints are no telephones in room for room service (not a huge deal for us) and no AC in the room, but they have huge windows which can be fully opened. The staff were incredible though, letting us borrow umbrellas for the rain, giving us maps and directions, and also when we had lost our only UK adapter for charging our phones gave us a very fancy one for free.  I would highly recommend this hotel to friends, and when I return to Edinburgh (which I most definitely will) I will be staying here without any hesitation.","0","0","0"
"3zRpneRKDsOPq92tq7ybAA","bjTcT8Ty4cJZhEOEo01FGA","uYHaNptLzDLoV_JZ_MuzUA","3","2016-10-02","If you need an inexpensive place to stay for a night or two then you may consider this place but for a longer stay I'd recommend somewhere with better amenities.   Pros: Great location- you're right by the train station, central location to get to old town and new town, and right by sight seeing his tours. Food, bars, and shopping all within walking distance. Location, location, location. Very clean and very good maid service  Cons: Tiny rooms  Uncomfortable bed  Absolutely no amenities  No phone in room  No wardrobe   Was given a lot of attitude about me and my husband sharing a room which was quite strange and we were charged 15 pounds more for double occupancy not sure why that matters I felt like it was a money grab. It was just handled in a kind of odd manner to me...   If you book this hotel all you get is a bed, desk, and a bathroom. It isn't awful but know what you're getting into.","0","0","0"
"ne5WhI1jUFOcRn-b-gAzHA","AXgRULmWcME7J6Ix3I--ww","uYHaNptLzDLoV_JZ_MuzUA","3","2015-09-17","Mittlerweile gibt es in Edinburgh zwei Ableger der Motel-One-Kette - diese hier ist eher das schlechtere.  Wir hatten auf unserer Schottlandtour die Gelegenheit beide Ableger kennenzulernen, da wir beide Nächte in Edinburgh (am ersten sowie am letzten Tag) in einem der beiden Motel One's verbrachten. Von diesem hier waren wir nach dem überraschend positiven Erlebnis im Motel One an der Princes Street [1] etwas enttäuscht.  Das Hotel ist wesentlich größer und extrem unübersichtlich. Da man auf der fünften Etage noch Teile eines weiteren Gebäude, das mittels einer Glasbrücke mit dem Hauptgebäude verbunden ist, hinzugenommen hat, kann die Suche nach dem Zimmer insbesondere auf dieser Etage zu einem Gang im Labyrinth ausarten. Habe ich so noch in keinem Hotel erlebt - uns begegneten immer wieder Menschen, die sich auf der Suche nach ihren Zimmern verirrt haben. Unser Zimmer war ähnlich aufgebaut wie das Zimmer im Motel One Princes Street - befand sich jedoch im Inneren des Gebäudes und hatte daher kein Fenster. Nur eine kleine Dachluke, die sich am oberen Ende eines etwa 3m langen Schachts befand, sorgte für einen minimalen Anteil Tageslicht im Zimmer. diese Luke ließ sich auch nicht öffnen, nur ein elektrisches Rollo ließ sich mittels eines Schalters öffnen bzw. schließen. Sonst gilt für das Zimmer eigentlich das Gleiche wie für das Zimmer im im Motel One Princes Street: Relativ klein, trotzdem extrem ansprechend und schick gestaltet und clever durchdacht. Dazu sehr ruhig.  Im gesamten Hotel gibt es kostenloses WLAN für die Dauer des Aufenthalts für maximal 3 Geräte.  Die Lage des Motel One Royal Mile ist großartig. Vom Airlink-Flughafenbus kann man quasi in den Hoteleingang stolpern, es sind maximal 50m. Zur Royal Mile sind es etwa 100m Luftlinie (bergauf) und man benötigt etwa 5 Minuten bis dort.  Das Frühstück für 9,50 GBP / Person kann man nutzen - muss man aber nicht. Es ist eher übersichtlich und kontinetaler Prägung, trotzdem aber sehr gut. Für den gleichen Preis oder weniger bekommt man aber problemlos ein reichhaltiges Frühstück in einem der zahlreichen Cafes von Edinburgh.  Für ein oder zwei Nächte kann man hier problemlos bleiben, sollte aber nicht allzuviel erwarten. Hat man die Wahl, sollte man meiner Erfahrung nach lieber auf das andere Motel One an der Princes Street ausweichen.    ---- [1] http://www.yelp.de/biz/motel-one-edinburgh-2?hrid=7UDwl3s_DuOokkGPZXZgBw","0","0","0"
"llmdwOgDReucVoWEry61Lw","oU2SSOmsp_A8JYI7Z2JJ5w","uYHaNptLzDLoV_JZ_MuzUA","4","2016-08-21","Location is everything and this hotel has it! The reception is inviting and open 24 hours. They are very helpful and have a lot of patience answering all my questions about where to go etc. there is also a lounge open 24 hours with snack-type food. Breakfast is continental-style so if you want heartier fare look elsewhere though you don't have to go far. The bus and train stations are right across the street so it's easy access to the airport or anywhere else you may want to go. Turn uphill to old town or cross the bridge to new town. The room with a view i got was spacious and comfortable though it's a bit of a maze to find it-just follow the signs. The windows are double paned so the room is quiet plus i was on the 5th floor which helps. It's a bit pricey but still one of the best values i found!","0","0","0"
"DuffS87NaSMDmIfluvT83g","0xtbPEna2Kei11vsU-U2Mw","uYHaNptLzDLoV_JZ_MuzUA","5","2013-11-20","gute lage im stadtzentrum. shoppingmeile und sehenswürdigkeiten, sowie gute pubs in laufweite. das hotel ist neu, gut gepflegt und hat bemühtes/nettes personal. ideal für einen kurztrip nach edinburgh. längere aufenthalte eher nicht, da die zimmer recht klein sind.","0","0","0"
"GvLmUkjUrOyFH8KFnmT1uw","rW8q706dz5-NnXDzMwVkiw","uYHaNptLzDLoV_JZ_MuzUA","5","2016-06-05","Erstklassige Lage. Dazu ist alles geschrieben  worden. Wir hatten Zimmer 718 mit Blick auf den Bahnhof. Ist zwar zu laut mit offenen Fenster nachts, aber der Ausblick verzeiht alles. Das Personal ist sehr freundlich und super hilfsbereit. Wer Edinburgh zu Fuß erkunden möchte, ist hier perfekt aufgehoben.","0","0","0"
"lGEl24NGj2HVBJrodeXcjg","yx8vNXUL0D0HS8rUIC7AFA","uYHaNptLzDLoV_JZ_MuzUA","4","2015-02-21","Beautiful space, great location, staff rock. Tiny room, but this was expected. Bathroom amazing. Walls, however, paper thin, which is why I can barely string a sentence together in this review.","0","0","0"
"cUgvEy5wj7zYE68v1BzzVg","zXnH6W74FAJQ7q7b-NuBsA","uYHaNptLzDLoV_JZ_MuzUA","4","2013-07-07","This is a fairly new property I think. It is a German company and has most of the amenities you would want. It is priced on the budget minded side so it won't break your bank. Location is really good. Near the Royal Mile and Waverley station without being too noisy. Very easy to walk to everything we wanted to do. Has WiFi but we did have to re-log in every day.","0","0","0"
"FSB_BnvysBgH3JYrbFNcgw","c5yp5hxwC1N98MjbV2LyWQ","uYHaNptLzDLoV_JZ_MuzUA","4","2013-04-27","First time at this group of hotels. Pretty new, only one in UK, another to open in Edinburgh and one in London. Rooms not very big but great price and location for a weekend in Edinburgh. Rooms clean, comfortable, good shower and free wifi!","2","0","2"
"dhl3ZW9aAEX_T7_um5tfaQ","xJisL5w4wOgiYLokGMT_IA","uYHaNptLzDLoV_JZ_MuzUA","4","2015-04-13","Location location location!   Motel One is just right in the middle of everything. To one side you have the New town and the main trains station ( and right in front of the airport bus)  and on the other side the beautiful old town of Edinburg.   The room was small but clean and with all you need.  The bathroom was also small but nice and clean and the shower was big and good! Next to the bed there is a European plug (CC 7/7) so we actually didn't need to use our adapter.   The beed was to hard for my back and I prefer the bed more soft, but I will still come back to Edinburgh and Motel One.","2","0","0"
"JQJvnM3p-3eML05eKcTgiw","tgV6tsYQ66DZ3LQKvtC6cw","uYHaNptLzDLoV_JZ_MuzUA","4","2016-11-08","A hotel that has all the basics that you'd need - no additional fuss. For the price we paid, I'd say this place is actually pretty good value. The location is super central and it's easy to get to everywhere from here! It's also right next to the airport shuttle bus and train station, so transport is also easy.   The insides is a bit of a maze depending on where your room is located - you may have to go down to go up to go back down again to get to your room! But no bother, it's good for walking off the chips and sobering from your drinks.","1","1","1"
"6JF4WfHgwYrrdZ2VeYtnFw","Q-3YCVywc03w56wYtGlKvg","uYHaNptLzDLoV_JZ_MuzUA","3","2015-07-27","Stayed here for two nights, costs was £109 per night for two people sharing a room which was not a budget price for what felt like budget rooms. Firstly they don't have any twin rooms in the hotel which would be preferable when I was sharing with a friend not my lover! There is only one small bin which is located in the bathroom.  No soap, which I find ridiculous, only toiletries were a dual shower gel/hair wash. There was a hairdryer but no wardrobes or drawers. Room was also very cold.   Now for the positive, the location is very good, close to princes street and St. Andrews square. The staff are very helpful and the bar is 24 hours.   Don't bother with the breakfast which is £9.50 each for a continental breakfast where you can easily get a cooked breakfast in any one of the cafes in Cockburn Street, which is adjacent to this hotel.   If I go to Edinburgh again I will book a different hotel.","1","0","0"
"fbVYETRuWDw8QnpimpGMpg","Cx4UCow0zQgFQOp47RRRaA","uYHaNptLzDLoV_JZ_MuzUA","4","2014-05-07","Well, i like the idea of Motel One. Always in the center of the city, somehow modern design, good beds. No fancy unnecessary stuff. All of this is true for this motel one in Edinburgh. Perfectly located even if it's hard to discover.  Breakfast is ok, but not more.  Service is friendly.  No twin rooms available..","1","0","0"
"lobj38NgaokqVseN8_nn6g","eqWEgMH-DCP74i82BEAZzw","uYHaNptLzDLoV_JZ_MuzUA","4","2015-02-26","I really do love the Germans. This chain is spreading fast over there and they're bringing their efficiency and attention to detail with them here.   Motel One is, as the name suggests, aimed at the budget market. Rates for this venue range from approximately £69/night up. I booked ahead and appreciated the completely free reservation process with room guaranteed until 6pm on the day of arrival. If you give your credit card details, it's reserved beyond that time.  Location is excellent! If you exit from the Market St side of Waverly and turn right it's maybe 3 minutes away. It would be very hard to have it closer. That also makes it very close to the castle and Princes St. Welcome was warm and check-in easy. The lobby area is pretty small but clean and cosy with sweets, maps etc. There's a bar area down a few steps where they also serve the buffet breakfast each morning.  My room was the cheapest version and was internal, facing onto a courtyard. It had no view and was quite dark, but quiet. Everything was completely spotless. The bathroom was small but well designed and had a great shower. Bed was comfy with 2 single duvets. So continental, don't you know? I appreciated the tea and coffee making facilities (I'm like a beast without them), the decent sized TV and the free wifi. The hanging storage facilities are limited but it was fine for a few days.   Random: hands down the best hotel hairdryer I have ever used. And one of the best dryers in general-called a Black Mambo. It was worth staying there for that alone. Well, you know, also the really good value and the pristine conditions. But definitely the hairdryer.","1","0","0"
"ysfjtAWreLoy7um8WTb8xA","d0DGZRp6lHXGECJSc_nn-A","uYHaNptLzDLoV_JZ_MuzUA","5","2015-08-21","Motel One sets the standard for budget hotels. I stayed at the Dusseldorf branch a while ago so when I saw one in Edinburgh, I knew this was the place to book. We managed to get a reservation during the Edinburgh Fringe Festival and only booked a few weeks before. We did pay a premium over the normal rate but given the crowds in the city during this time, it was still a good deal compared to other hotels.  Staff were all friendly and welcoming, presentable and professional. We received a room upgrade with quite a large room overlooking the bridge crossing Waverley station to Princes St. Despite overlooking a busy road, the room was almost silent thanks to solid double glazing. The room temperature was perfectly controlled with an individual A/C unit. Super clean, modern, uncluttered. Bathroom was similar. No slamming doors or noise in the night. Bonus.  Free wifi that works with one log in (doesn't require repeated log ins as some places do) and had decent signal strength.  The buffet continental breakfast was also a hit with fresh croissants, danishes, cold cuts, cheese, toast, fruit and yoghurt all well presented, fresh and good quality as was the coffee.  If I am looking for a reasonable hotel in a city, Motel One will be by first choice.","1","0","1"
"OF1ToqGAubsWGri5iad15w","IpLZ7RevQrFPJWYc9Gxymg","uYHaNptLzDLoV_JZ_MuzUA","3","2013-12-07","Had Continental style breakfast here a short distance from Waverley Station as I had half hour before a train home and wanted to try somewhere new. Motel1One is nearby and a easy two minute walk, slightly uphill towards the castle from the station.   On entry it's modern, cosy has tons of cool yet bright pastel and mochilato colours to accommodate your cold wintertime self. Wooden floors, warm rugs, sheepskins on the sofas, slate walls and oak barrelled tables, with slight distinct Scottish themes due to their tartan furnished accessories completes the feel.  I sat in One Lounge, had tea and food self served for well under £10, you know bran, meats cheese and croissant that sort of stuff. With a copy of local newspaper in hand I really needed to eat, stay warm and access wifi, the reasons I came in.  Some hotels in the city give you access to wifi if your a paying guest, but repeated attempts to access their wifi even with staff help, eventually gave access but in German. On going to reception again for additional help the staff were great got the correct website for me, but still no luck.  Hmmm, by the time this was all done I came back to cold tea and didn't really have time now to finish a second cup of hot Earl Grey, so sorry to staff for removing an almost full cup of tea. Great place though nice breakfast and funky decor especially the plasma tv displaying a roasting log fire in reception, but sadly for me no easy access to wifi when badly required.  Maybe next time I will endeavour to try food against technology!","1","0","0"
"ByRzJ8rF2KJWLr-cUNU6EA","kzyLOqiJvyw_FWFTw2rjiQ","jQsNFOzDpxPmOurSWCg1vQ","1","2017-06-03","This place is horrible, we were so excited to try it since I got a gift card for my birthday. We went in an ordered are whole meal and they did not except are gift card, because their system was down. Unacceptable, this would have been so helpful if we would have known this prior!!","0","0","0"
"i5UwUPlQFPLcE8p2gPFwBw","WZXp9-V2dqRRJqhGgRqueA","jQsNFOzDpxPmOurSWCg1vQ","4","2015-03-26","For being fairly ""fast"" food.. Pei Wei (pronounced pay way I confirmed haha) is pretty darn good. we got a few things to share. I had the Asian chicken salad and was impressed! There was a decent amount of chicken. Some more veggies would be nice, but overall pretty good. The steak teriyaki was great as well as the fried rice. Over all good was good! Nice, clean, and reasonable.","1","0","0"
"EyQyvTTg2jX4or9bB8PC9g","XylT12exfdLiI_3uDLVIpw","jQsNFOzDpxPmOurSWCg1vQ","5","2012-12-30","I decided to try it out, I'm celiac and therefore can only eat gluten free... They have an easy to understand GF Menu with anything you can possibly want.  I placed my order online and picked the exact pickup time. I cam and my food was ready for me. Driving home the smell in my car was so good I could barely wait to get home and try it - true umami!  I got home and dug into the delicious spicy chicken and rice with sugar snapies and carrots. It was superb! For $9 I will definitely try this again! I did see a huge line at the store, so try doing an online order and pickup forsure!  p.s. they even include GF soy sauce!","2","1","1"
"G-EFA005besj5uHsH0sQFA","Ji9PeffxjwqPLO7pEfSpKQ","jQsNFOzDpxPmOurSWCg1vQ","3","2009-01-12","I'm not saying Pei Wei is the best asian food I've ever tasted, far from it, it's a fairly large chain that puts on the appearance of something more refined, it's essentially to Asian food what Olive Garden is to Italian Food.  With that said I've always had pretty good experiences with Pei Wei, the food although not spectacular is better than some of the overcooked chicken drowning in MSG offered by some of the local chinese restaurants.  the portions are good sized, the food is generally consistent, and the prices are really reasonable considering this is a corporate chain in some cases cheaper than the local establishments. or dare I say it's name ""panda express"" (which is overpriced crap)  the time before last that I went they forgot the tomato's and the dressing for an asian chopped chicken salad that my wife ordered, I didn't discover that the dressing was missing until I got home, I immediately called the restaurant and was speaking to a manager within 30 seconds. The manager apologized and asked me If I would like to come back to the restaurant or if he could have my address so he could send me a gift certificate. I decided to go back to the restaurant, when I got the restaurant I told the person at the counter my name and they already had a bag set aside for me, the manager came over and explained to me there was another full salad in the bag, and he put additional dressing for the salad we already had, and additionally he gave me a coupon for free lettuce wraps.(which mental note: I need to use)  I must say I was impressed with this manager, and it was refreshing after being in situations where a manager has taken back the bag/plate and essentially ""un-F$@k's"" your food and returns it to you.  Overall great customer service, consistent food, and a good option for takeout in surprise.","1","1","1"
"6PcJSGUBSLjt4VLXos5C4A","TLIWzAJPrET0zX4_vgvLhg","jQsNFOzDpxPmOurSWCg1vQ","3","2015-07-11","Sometimes the food is spot on and delicious and other times it is quite salty at this location.  Very difficult to get a consistently good meal.  Menu items add up quickly.","0","0","0"
"PFJmyZD_lNBa_Y3kbX1VvA","JZEiTNWBwmv6MOOXYCAaMQ","jQsNFOzDpxPmOurSWCg1vQ","1","2015-05-27","Decent customer service but the food was awful. It was cold and had no sauce at all. I was expecting it to be good but this place really went down hill. I will never eat here again.","0","0","0"
"_Qv1FQUToLrKMuG6pV4Gzw","E56sVQT5-OWfSejJrma8_w","jQsNFOzDpxPmOurSWCg1vQ","5","2015-02-28","Super clean restaurant and friendly staff. FRESH food. Hasn't been sitting under heat lamps. NO MSG, this is the good stuff. I have to have the Kung Pao Chicken weekly.","1","1","1"
"s2mlqrFNaPEGtcnEu3EJ4Q","4WYICo4emecA9r7sPYQkBw","jQsNFOzDpxPmOurSWCg1vQ","4","2010-04-05","Found this the other night.  It is the PF Chang fast food option and it worked perfectly for us.  Limited menu, but lower prices. Very basic decor, but clean and fast seating.  Lettuce Wraps just as good as Chang's.  Very busy, especially the take out.  Glad to have it close","0","0","0"
"oiSzZRrbi3y01_wqU528ZQ","P8mVj7AZwJTFFH5FXbbmUg","jQsNFOzDpxPmOurSWCg1vQ","1","2015-05-22","The staff here is great and they're nice,  wonderful and quick. People were ranting in raving about pei wei, I had to try it.  Even good yelp reviews.  I'm highly dissatisfied with the flavor of the food. This  should be labeled Asian inspired and not Asian. I've tried a variety of Chinese restaurants, this doesn't taste close to anything I've had at other Asian restaurants. Their Mongolian beef  was 5 pieces of beef and large mushrooms cut into thirds in a thick sauce. You eat the rice to wash off the nasty flavor. My shrimp was thickly coated in an overpowering  sauce as well.  I only ate some of the veggies that take center stage on a meat dish.  The center of my pork egg roll was cold. The hot N sour soup was a much thicker consistency almost like that of a chili instead of being brothy. Worst of all was the price.  This was not worth it to us. Neither me or my husband enjoyed either of  our dishes.  We didn't even eat half of our plates.  We even refused to take it home with us.  If you like and enjoy what typical Asian food tastes like,  don't waste your time here.","0","0","0"
"4BPjRE9VI0HhyZzyyYv0BQ","7Y4NEBQqWg7j-TvrQi6UZQ","jQsNFOzDpxPmOurSWCg1vQ","2","2011-06-15","I had the garlic ginger broccoli chicken and it was not very good. The broccoli was hardly cooked and the sauce was way to sweet. Everything else was great. I will give them a few more tries before I write them off as another crappy Asian restaurant in Surprise.","1","0","0"
"kznHtw1Qido_9GX6sDQPJw","vgZqQqe8cj6SBMH0EqDliw","jQsNFOzDpxPmOurSWCg1vQ","5","2017-03-12","This review is based upon consistency of flavor and great customer service.  We came and there was an unknown issue that required a 25 minute wait for food.  The employee notified us, and although hesitant, we decided to stay.  We have been here numerous times before in the past years so we are familiar with this location.  The employee was apologetic and gave us a free drink.  That was a simple gesture but rarely do you see decent customer service anymore.  We received our food and had an issue with an incorrect order.  It was explained and the issue was resolved quickly.  They gave us a free appetizer.  We do not expect perfection, nor free food.  This restaurant cares for customers and works to provide a positive experience.  We would return again because they have good food and they care.  That is a rarity in today's restaurant culture.  Kudos to the manager for creating this culture.  Ordered- fried rive and Tofu, edamame, won ton soup, dynamite chx, and Thai curry chx","0","0","0"
"HWRTVn3Lc-RwN6udv4WJzQ","O7G_c6wFXSygr82qs0GAcA","jQsNFOzDpxPmOurSWCg1vQ","5","2016-12-19","I love this place i'd recommend it to anyone ! We always order it togo and it never disappoints! The food always taste fresh and is always ready on time! Definitely our favorite lunch spot !","1","0","1"
"GiEB_A-m9HuX521WQNbL8w","UG4EKu13JRwzRix6ESINdg","jQsNFOzDpxPmOurSWCg1vQ","4","2011-08-10","1st! Place is not closed. There was an issue with legal workers in the franchise chain. Now they are back! Food is one of the best! Especially their chicken mango! Daughter is a huge PF Chang fan, so she loves this place also! Her favorite is their Mongolian beef, and noodles! They are always coming up with something new, so you may have to try them more then a few times.","1","0","0"
"GKi4i6qocIgaYcwv1_0zzQ","ZZG6yR27lIy3xwUYVgHO7w","jQsNFOzDpxPmOurSWCg1vQ","2","2013-06-17","Definitely not a fan. Coming from Orange County, CA, I have high expectations when it comes to Asian food.  Suffice to say that Panda Express would have been a better choice, which is pretty sad.","0","0","0"
"OrhWg2MmCznwfKfjHKvuhA","1YorWW0Z-YDuYC5GplNabw","jQsNFOzDpxPmOurSWCg1vQ","3","2015-11-03","Pretty good, not great. Definitely overpriced. It's barely a step up from Panda and not worth the price difference. Not saying it was bad, but $25 for two basic dishes is a bit much and they didn't make the order how I requested.","0","0","0"
"QXWku_OB3FCj9VCZfUZwwg","ujOPJEz_KxzAyZDnji-2Ng","jQsNFOzDpxPmOurSWCg1vQ","1","2017-07-08","I wish I could give 1.5 stars. Nothing special. Lack of flavor. The entrees were either sweet or spicy. The crab Rangoon were.....different. The filling had a mealy consistency. Friend rice was bland. Plenty of other places to spend 50$ on takeout. Save your money.","0","0","0"
"5NtaW5EwXK595kP4Ynnisg","6aEUn50d3Ts7MiGu6WdpKA","jQsNFOzDpxPmOurSWCg1vQ","2","2015-09-22","Disappointed that on yelp their hours show them open at 1030am but when you arrive they don't open until 11am. Waiting in the car to pick up a large order makes me think twice about catering from here. Don't get me wrong the food is great as always but they need to fix this.","1","0","0"
"ai6O4UqqDqnjO7gfz6jBkA","R6vb0FtmClhfwajs_AuusQ","jQsNFOzDpxPmOurSWCg1vQ","3","2012-10-08","1st visit had the lo mein...delish!   2nd visit had the teriyaki...fine if you like salt.  Ick!","0","0","0"
"ZrvsD7PSyPolII3gp4-uHw","CPuUagT2rfUJm6hRgxn3JQ","jQsNFOzDpxPmOurSWCg1vQ","5","2015-12-28","As a vegetarian, it can difficult to find places with good options, but I love getting a tofu bowl at Pei Wei. The first time I had it, I had to double check because it looks and has a similar texture to meat, but it's great. I love going to Pei Wei","0","0","0"
