"review_id","user_id","business_id","stars","date","text","useful","funny","cool"
"XE5cH2N76p3VH2p_2n_A2Q","zcJSnim_9jdlANJpRve2lQ","cOWBLBde6AAwzBDuoa85Ag","1","2017-03-20","I have been having my nails done now for over 30 years, and over this time frame, I have lived in 3 different states. I had to go to several different shops here in Arizona, since moving here 17 years ago, before I found the right one. I was very happy at that salon for almost 10 years. During those 10 years, I went to the same nail tech,for about 8 of the 10 years,he did a great job, my nails lasted, and all was well!  For personal reasons I had to find a new salon. So I went to a new place, it had high reviews and I got a new set and a gel pedicure! Everyone was nice and all looked okay, but they were so SLOW I was there 5 HOURS!!...I couldn't imagine ever going back there again, they were closed for over an hour, and I was still in there , the ONLY 1 in there!.....Not fun!  So I was stressed after that  , and knew I needed to  find a new place so now I am in the present time, and brings me to my review here today.  I took my time,and for 2 weeks,  I really did my homework. I researched, googled. read reviews, and finally decided on where I would go.  I chose Fancy Nails & Spa on Cave Creek Rd in Phoenix.  I didn't just make an appointment either. After I was done with all my research , I called about  4 of  the salons,  and went in person,  to see the salons, and speak to them, as well, as look at there selections of powders / colors.  When I first called Fancy nails I spoke to the Owner David, he was very friendly. He offered for me to come in, and take a look, and told me they would take care of me, When I went to the shop, again he was friendly, I decided to make an appointment. For a new set and gel pedicure with Kim also eye brow wax. They didn't have the chunky/confetti powder that I am used to, but assured me they could order at a later time.My nails seemed okay, I was just glad to have them done, and have found a place, that I didn't  pay to close attention.As the holidays were fast approaching and I was very busy at that time. The gel pedicure was good looked nice. But I was a bit disapointed that my, toe nails were grown out so quickly, as I had said please make them extra short, I like them short. And even after she first cut them, I asked her to trim off more, glad I did, because they were still to long. I figured though it was my first time, so next time it will be better.  I always got compliments  on my nails, especially the last 10 years. Well all of a sudden no one is complimenting me?! I thought that is really strange?! After a couple days I looked harder at my nails and I could see every little mark under the pink area?...and it looked weird....they never looked like that before. . I had them use medium pink, same thing I had always used, for 10 years . Then still no compliments, and each day they looked worse... it was like you could see all the drill marks straight through it, on my nail beds. I went back to my next appointment because now new years Eve was here, and I had a party to go to. This time the same thing happened with my nails, and my pedicure also. Now my daughter is asking me whats wrong with my nails?...And even my husband!. They don't  look nice anymore, my husband says. I wanted to cry. So I called the nail salon and spoke to David the owner, he said come in and he would take care of me himself. So I did, and he said they needed to be removed, and cleaned up underneath, and a whole new set, and he would take care of me, and he did!...:) So now everything will be okay..right? wrong!!.... It helped,  But he had to drill my nail beds way way down a lot and it hurt real real bad to do that!...I had another pedicure by a different tech, once again I explained they were left to long  2 times, and I like them extra short,  make them very short. They said yes but, they did not. After 2 weeks ( and still no compliments) I was beside myself. So I made my appointment with David again, thinking Id try one more time. And when I got there I showed him all the drill marks on my nail beds. He then showed his daughter Hannah, and had her do my nails.She said would do back / fill and use ""her"" medium pink powder.  and it will cover all those marks. She then proceeded, without saying anything to literally rip off my finger nail, it hurt!. I pulled away, in pain, and said, no! you need to soak them off!..and she laughed!! and said I was sensitive and begin to rip again!.OMG!I couldnt believe it now there was BLOOD! and a huge throbbing pain she laughed again! I had tears It hurt for the whole time, she was not even sorry.When she was finally finished, They looked good, so I thought it might be Okay Well wrong again! 2 days later 1 nail was lifting!..I called Hannah.Can she please fix it? She said to busy!!..Maybe tomorrow!!?? I got really upset. Then she said ok come in.The owner David looked at it, he fixed it, and never said 1 word to me the whole time.I knew right then, I would not be returning. Next day another nail lifted and came off 1 by 1 til all are gone just shy of 12 days! OMG","0","0","0"
"-wlzNwfH69QbN3qry2zWig","ALK9WBaokEtmotik0RepTQ","cOWBLBde6AAwzBDuoa85Ag","4","2014-06-29","I was looking for a nail parlor that was close-ish to my area, and this place by far had the best and most consistent reviews. Called to make an appointment to do my gel nails, and the man on the phone was very clear about directions. Upon arriving there i can absolutely see why people might get lost. They're tucked into the back of a complex on Rose Garden lane. Easiest way to get there would be to turn and go east onto Rose Garden lane and then turn left (north) into the red brick complex. They're straight ahead of you there.   It's a nice new place, and was pretty busy when I got there, even though it was 1000 on a Saturday and they had only opened at 0900. Most people were actually there for pedis. Since I had an appointment I was seated almost right away, and they got down to removing my previous gel manicure and get a new one on me.  I do have to make a disclaimer- I hadn't always had a great experience with gel nails. I did them for my wedding and loved them, and went back to get them done after they grew out, for a bachelorette party in Vegas. The removal process was horrid- they used this thing to scrape the stuff off and it felt awful. And then I left, went shopping and literally in an HOUR had a giant chip. Of course there was no time to go back and get it fixed. It was a very disappointing experience.  But getting mine done when I was out of town had been pleasant, and my best friend said she was addicted to them. So I decided to give it a shot again.   And I'm glad I did. The removal process here was quick and painless- the gel manicure crumbled off when it came time to scrape it off, no awful sensations necessary. They had a great range of colors, and my lady even tried to recommend another color for me. (I wound up sticking with the color I wanted). The nails were beautifully done, and she did them promptly- I was in and out of the place in under an hour. I did decide to wait about a week to do a review, to see how well these puppies wear. The manicure I had prior to this chipped a bit on the thumbs within a week, which was also a bit disappointing.  A week and these nails look as good as they did when I left the salon. I'm hard on my nails too- I pound at a keyboard, and have two big, rough dogs at home. These still look great- no chips, wonderful shine.   I think I might have found my newest addiction, and I'll definitely be back to get them done again!   Please do note that you can pay with DEBIT cards, but not credit. Also, like several reviewers noted below- bring CASH to tip.","2","0","0"
"xN4aQpzixhMtr5yKUiqfzg","y3FNK-UpHuXmNucC_6slrA","cOWBLBde6AAwzBDuoa85Ag","5","2017-07-18","Im a regular at fancy nails, I just love their staff and service.  They just moved the salon a few doors down to a bigger spot, which has better air ventilation(no nail odor).  I usually come with a big party because they have plenty of room to accommodate us all.  I get SNS and a pedicure which last me about three weeks.  Highly recommend this salon.","0","0","0"
"wBKpE7i1bqlxwNK_vgYvFw","Kn3oeT-CGx2cbyyNmi2MOg","cOWBLBde6AAwzBDuoa85Ag","5","2014-02-20","Best Salon ever! I'm so sad to be moving soon and I will miss David and Steven terribly.","0","0","0"
"kCUMAS6w3p8s82j3SqxA2A","IZV6t4l-YivWsc8cEytEHw","cOWBLBde6AAwzBDuoa85Ag","5","2015-04-26","Since I moved to Phoenix, I've happily driven 18 miles (one way) to have my nails done here.  Definitely the cleanest nail salon I've ever seen.  I like that they use disposable liners in the pedicure tubs.  Amazing colors of gel and regular polish.  Friendly and detailed staff.  Wish I could give 10 stars.  Very reasonably priced.","0","0","0"
"FcU_P_BNsHnMsAvFKdAZiA","m8TocXqEEPsxjmz1ql7_3g","cOWBLBde6AAwzBDuoa85Ag","5","2015-01-11","Been coming to Fancy Nails for a few months. The place is very nice offering a number of features that give it an edge-nice decor, curtains separating some of the pedi chairs, a Keurig machine with coffee. Pedicures are relaxing and thorough. Very skilled nail technicians with both gel and acrylic. Got a nice bottle of lotion as a thank you Christmas gift last month. My new nail place!","1","0","0"
"PKjIhafXlHEgtiMrpLjo8A","jY6G9fiCM-Vo9z1uK1dQDQ","cOWBLBde6AAwzBDuoa85Ag","5","2016-06-08","Best & cleanest nail shop in Northeast Phoenix!  David & his nail techs have the latest colors!  Try the mood gel polish!  Changes color in cold or with water!  They have liners in tubs and keep everything very clean!  You will love it here! Thanks David & awesome nail techs!","0","0","0"
"oIxBBbqCsMoNuUzEchEeiQ","3-pqtVa42oESLX8_90XzTg","cOWBLBde6AAwzBDuoa85Ag","1","2016-10-17","I'm a business owner myself. I made an appointment the day before to get a gel pedicure, and a back fill. The reviews I read were really great. I'd been seeing the same nail tech for 6yrs and never had I complained. However she moved to California. They put me with a guy that didn't speak any English. I get my pedicure & nails done every 10 days. this young man took 90mins doing nothing! He put callus remover on my feet and then place them in the water Hmmm... I wonder where he got his nail tech license? He didn't remove the skin or calluses on my feet after putting callus remover on them. The shape of my toenails are not the same or even. Oh! And he forgot to massage my feet!! Then the owner came over and told me that they're really busy and couldn't do my nails and could I come back tomorrow and he would do a very good job on my nails for me!!  I sat in that chair for 90 minutes frustrated with this moron that shouldn't be doing pedicures or any other kind of service. It was inadequate & way below average customer service. I watched the owner book appointments for ladies that just walked in with no appointment and ask them to come back in 20mins. Well I dealt with being stressed out by someone that was not properly doing their service then being told that they didn't have time to do my nails because they were too busy! I was charged $48 for something that I most certainly was not happy with. I told the owner to stick it up his A..  How can anyone be so rude I don't know? I wish there was a law or a requirement that in order to get your license to be a nail technician or to perform any kind of public service that every individual of any race needed to speak and understand The English language fluently before they were able to obtain their license!   I owned 2 hair salons in scottsdale and I don't ever recommend anyone going to fancy nails.","0","0","0"
"1ctLdRJjP9m5QdL7ruYAzA","kLRQZ3MuaAqfgWBOm5pB0A","cOWBLBde6AAwzBDuoa85Ag","1","2014-09-08","I will NEVER go to this salon again to get any service.  I have been a customer of this nail salon for over a year.  Last week I called to schedule an appointment.  After waiting 20 minutes with feet soaking & water now cold-I asked how much longer it would be.  The lady beside me said she would be doing my pedi & it would only be a few more minutes.  I understand a delay, but what's the point of making an appt. if you wait that long?  Once she began my pedicure she seemed to be rushing.  I have 3 places on my feet where she rubbed with the pumice so hard that she burned skin off like an abrasion.  This was on Sat, today is Monday & it still hurts & has not healed.  I will find a new salon.  Wish I knew the ladies name & I would post this!!!  I told her it was hurting so she stopped rubbing so damn hard.  After she painted my toes, she put antiseptic on the worst burn-that only made it burn more!!!  Terrible service...unsatisfied","1","0","0"
"DpwR9r16eiMec0BMALlAWw","EkvFZ7vHwEpkKGY5-WeaUQ","cOWBLBde6AAwzBDuoa85Ag","5","2014-11-23","Fancy Nails is a great place to go when you are in a rush and need your nails done.  Firstly when you walk in they assist you right away, and soon enough your in your seat.  Let's say you got gels they would check every coat before putting it in the light. And they turn out perfect!  They also have a great coffee machine and water.  The people are super nice and great at what they do. It is also a very clean shop which has super comfy chairs washed supplies and the nicest polishes. So be sure to go to Fancy Nails, the nicest and neatest nail salon on earth!","0","0","0"
"T8Y-sDeLHhoKFWBEMob1VQ","seXjsuewdnh8-y8Ruow-Kg","cOWBLBde6AAwzBDuoa85Ag","1","2014-11-02","Very disappointed with the pedicure I received. It was extremely rushed and lacked the sentiment of pampering yourself and relaxing. It was not meticulously done and there was nail polish left on my skin. I  can definitely do a better job myself.   In addition to that, the nail technician cut my big toenail at an angle to the inside on each side of the nail, and it looks absolutely ridiculous. It was only that one nail so my overall pedicure is inconsistent. I brought it to her attention even though there was nothing she could do to change it and she brushed it off and said that's how it's done.","0","0","0"
"mpjVk2W8d3QXbmSnkNXrGQ","riaO_Lw2qfLBu22FpdMA_w","cOWBLBde6AAwzBDuoa85Ag","5","2014-09-28","Overall great experience Everytime I have been in here. Weekends get slammed so if you want a longer massage and more time spent then you need to go in during the week. Very consistent in here as far as cleanliness and service. Always a great idea to call ahead and let them know you are coming to make sure there isn't a wait.","1","0","0"
"w0ABMHww4KHCHUp0eh9zog","U0PtdIN508sn8RVJ4Mcs6w","cOWBLBde6AAwzBDuoa85Ag","5","2014-10-19","I've been here four times and each time was relaxing. Its quiet, does great work, and I'm going back again next weekend.","0","0","0"
"UXNLOvawyTLHqF1g0cn66Q","HEobaj3QfS15reMJdhv3Rg","cOWBLBde6AAwzBDuoa85Ag","5","2016-08-03","Holly is amazing I've been seeing her for years. She always helps me with my ingrown toe nail and she does an amazing massage. She cares with much detail. Best massage chairs in town. Great owner. This is my monthly stop !! :)","1","0","0"
"Yvb0sza8E0Tu9PbfMp_teQ","KZuxsItTyLGxowvFSQxhIw","cOWBLBde6AAwzBDuoa85Ag","4","2014-10-10","I'm normally not a girly girl so nail salons don't really interests me but I was on vacation with my chica and decided what the hell, why not? So this review is from not your typical girl who gets their nails done routinely. I probably do it once every few years lol. Upon arrival, this nail salon looks very fancy and clean. Their tools I think are packaged and their prices are pretty standard. This place is also the 1st time in my life to get my nails done by a guy 0.0 I think the techs there are nice and friendly and they explained to me any questions I had like what is difference between gel manicure and regular ones. I believe there is a pretty big selection of colors to choose. Since I'm not an expert, check out my pics and see for yourself! :)  Also, they provide free coffee and candy. The only reason I didn't give 5 stars was because my legs became a mosquito buffet but it's not their fault and it's pretty cool there with ceiling fans turned on.","0","0","0"
"L6uaksyM01k0HR7oVOaN3A","SbMSN-N7WGW3W8ayZYru0w","cOWBLBde6AAwzBDuoa85Ag","5","2014-03-01","Very nice girls, clean salon and quick service.  If you pay with cash, you get a 5% discount. If you pay with debit, you can't add a tip to the charge, so be sure to bring cash.   I counted 17 people working today, very busy on the weekend, I dropped in with no appointment and got right in, 1 hour later, fresh mani/pedi in Lincoln Park After Dark (my favorite color).  Go here!","2","0","0"
"8X8KUOSLhzoqhgDN90-Dxw","V76ogoQDj2CoHbHkM06l_w","cOWBLBde6AAwzBDuoa85Ag","1","2015-12-05","I've been to this salon twice. The first time was great and I was very happy with my gel manicure that lasted a very long time. The second time I came in and it was horrible!!!! I asked for a full set of acrylics. I got seated with the male tech. At first he was very nice and then when I asked for them to be a certain length he told me no and that that was ugly! I was so offended! I asked him again to go shorter and he refused. I finally picked a color and he did a horrible job. The color came out so streaky. I left and my nails looked horrible. My cuticles were still a mess, the lengths were all uneven and the polish sucked. I'm never going here again!!!!","0","0","0"
"uuXUDGO5kM1FtGx4FI0ZWg","CfQoqHt4ED57HY_RsCNhxg","cOWBLBde6AAwzBDuoa85Ag","4","2013-10-30","Went on a whim while running errands and I was helped right away. The salon was very clean and the chairs comfy. The staff was friendly and though it was busy it was fairly quiet so I felt I could relax. basic mani/pedi for $34, not too bad! Will be visiting again!","0","0","0"
"Os9pnsmw71rCWgToKKQGXg","tsXlmhcm5I43HrWvzrH9ew","cOWBLBde6AAwzBDuoa85Ag","1","2017-05-10","Terrible!! This was my first and my last time coming here. I came for a relaxing pedicure and dip powder manicure. I sat for my pedicure in between 2 ladies who were already well into their pedicures yet mine was done way before theirs. How is this possible when I got the same services they did? I asked them what pedicure they got and it was the same as me. Maybe because a guy was doing mine and he seemed to hate his job.  Hm... mine lasted about 15 minutes their pedicures lasted at least 30 - 40 if not more. Then I sit for my powder manicure. It was so bad I had the girl remove it. It took her 3 times of soaking my nails with the foil to get the gel off, that's how thick and awful it was. As I leave they charge me for my pedicure, ok fine, yes I got a pedicure, here's the kicker, she charges me $10 for a cuticle trim!! Are you serious? I left and immediately called my bank to dispute the charge. Worst customer service ever!!","0","0","0"
"NGfWerOWmAW32Mo95qeWCQ","Z9a42HVMX8bTUZO8_EZw0A","cOWBLBde6AAwzBDuoa85Ag","1","2017-05-10","My manicure was sub par and the owner was rude. He refused my Amex card only after seeing that I had other cards in my wallet. As if that wasn't enough he was rude about it claiming they charge him too many fees. I will not return.","0","0","0"
"HZGqeD16bQfkGJYNZYQRRw","Qvm3bvzfmudQ5p6PaV-VuQ","cOWBLBde6AAwzBDuoa85Ag","5","2015-12-20","This place is absolutely FANTASTIC!!  I did not have an appointment, but they got me in right away.  I had a full mani-pedi and an absolutely thrilled with the results.  I believe it was Jessica and David who helped me and they were both friendly as can be.  Hannah also was great.  I definitely recommend this place!!","0","0","0"
"yu2KZdzMnEo0wGdhZYDzQQ","VBSCDqyBRltgvBxLNOR4Uw","cOWBLBde6AAwzBDuoa85Ag","5","2013-10-23","Love this salon. Kim is very friendly and did a really nice job on my mani and pedi. The owner runs a very tight ship and not very many people are talking, it's very quiet, the staff are very attentive and it's very relaxing. The place is very very clean. I will make this my nail salon now, it's reasonable, friendly, clean and relaxing, what more could you want?","0","0","0"
"H43aPUwEWxNZoitrUQzb6A","q7MRk6FBmx0H2xrZ10QUpQ","cOWBLBde6AAwzBDuoa85Ag","5","2014-05-29","Lovely ambiance Attentive staff Reasonable prices They use disposable liners for their foot spas, which lessen the risk of catching bacterial infection. Everyone is great, my favorite is Lynn. She is super talented!","1","0","0"
"hsTbfMqB2FCSXARx7i7Jcg","XdLf7dZH-6kEcZMzo-lG8A","cOWBLBde6AAwzBDuoa85Ag","4","2013-11-20","Needed a new nail place closer to my house so went here on a whim. I went on a wed afternoon so was pretty quiet and they were able to get me in right away. Pedicure was very nice, massage was long, they offered me a bottle of water, normal prices, clean place, and friendly staff. My only complaint was they didn't have me sit under the lamp to dry so after I got home I noticed one if my toes was smeared. Luckily I brought my own polish so I could touch it up. I will be going here again.","0","0","0"
"Li_u03721rnB2YpK26tERQ","ZvfnsPr4I9tsIMimN0qHtA","cOWBLBde6AAwzBDuoa85Ag","5","2017-05-15","Just found this little gem!   We both had fabulous paraffin spa pedicures with hot stone massage. Very nice!!!  Hanna did a fabulous job on my powder mani!   Everyone was super personable and the shop is beautiful and spotlessly clean... they are opening the new shop in four weeks and the pictures David showed us are OVER THE TOP!!!  We will definitely be back... this is our new spot!","0","0","0"
"U-pppHSGa5pJ57okTl8Mow","9R19VOuHHzdsZUrE0eecgw","cOWBLBde6AAwzBDuoa85Ag","5","2014-04-24","Love this nail salon! They are clean, friendly and my mani/pedis always look awesome. I even took my 5 year old niece last time and they were so great with her!  Don't forget to bring cash!","0","0","0"
"Qo6pq2VH8RaxdmAXeLSMpQ","PB1bOiWSUMipc2km17q4uw","cOWBLBde6AAwzBDuoa85Ag","5","2016-01-11","I've been going to Fancy Nails since I moved to PHX in July of last year based on the Yelp* reviews and have never been disappointed.  This is the first salon I have been to in a long time where I don't have a specific technician work on my nails.  Every person in the salon does a great job.  I am fortunate to be out of work before 3pm during the week so I can get to Fancy Nails by about 3:15...I've never had to wait for a service when I arrive around that time.  I have been on weekends and it does get busy, so I'd recommend you make an appointment.  The salon stocks OPI shellac/gel polish in addition to some other brands I don't recognize. A gel manicure costs $25. For all of my pedicure people, Fancy Nails uses disposable pedi tub inserts so no worries about someone else's foot funk touching your tootsies (big plus)!  They have a few options for pedicures, so ask to see the menu before you start.  They also offer waxing services and tanning as well but I can't comment on them since I've never used them. The salon is clean, well stocked, and everyone is always professional and courteous.  There are plenty of other nail salons closer to where I live but I choose to come to Fancy Nails.  They're everything I was looking for in a nail salon!","6","4","4"
"ZrVQz1SKMfRAu86SlpMblQ","jVkOyGV7CybBfqk6vF3Q-A","cOWBLBde6AAwzBDuoa85Ag","5","2013-11-24","Thank you yelpers!! I found also found this place to be awesome!! Clean and lots of gel colors and glitter to choose from. Ill be back there for sure!!","1","0","0"
"eK2OOv1r5Zua5e43rbWmlQ","_labePetwAjwgWBUgV4wUg","cOWBLBde6AAwzBDuoa85Ag","4","2015-06-06","This was my 1st time at Fancy. I took a chance coming in on a friday w/o an appt but was greeted and seated right away. I met Hannah and she did a gel manicure. Very sweet and friendly. She was quick and did a great job. Another girl did my pedi and I was happy with that as well. The place was nice looking and clean and I liked the service. Prices were fair and I will def be back!","0","0","0"
"7f7k1eIdqjdB9c-JgFPLqg","Wyciy32b2y-8XDwM_mSCcA","cOWBLBde6AAwzBDuoa85Ag","3","2017-05-02","Had an appointment at 4:30. Hit bad traffic and called to say we would be 5-10 minutes late. Got there and it was not as if anyone had just been seated -- they didn't skip a beat with getting folks in prior. So, we had to wait. No one looked up and acknowledged us. Waited until 5:00, when we were finally acknowledged and we had to mention the appointment time that has long passed.  My daughter asked for shorter nails twice and nail tech did not listen. 5:45 and still here. Frustrating.  Tips:   1. Honor appointments.  2. Greet customers as they walk in.  3. Techs need to listen to their customers and also consider their age. My daughter is barely 14, and asked for shorter nails but did not get what she asked for. 4. When nail techs aren't busy, do not sit in front lobby area on your phone with headphones on all kicked back.","0","0","0"
"N-_MXQNFdaKAD7M0tnWtRQ","4jN7gnDv9GJrNx_fPUziZg","cOWBLBde6AAwzBDuoa85Ag","5","2014-10-03","Best nail salon I've been to in the Valley. I never have to wait. I don't ask for anyone in particular because every person who has done my nails has been fabulous. The polish lasts for longer than any salon I've been to. Love this place!!","0","0","0"
