"review_id","user_id","business_id","stars","date","text","useful","funny","cool"
"BLIJFaJZ-_fOcBs16fL_6g","jgzD7eBwZrasqy6wUy122w","OQcvO5P3gH0cuJ-bPXwfQQ","5","2017-04-01","Loved, Loved, Loved. It is a simple place, but you dont come to this place for the decor. You come for the damn good food.   Please note* I am just a customer. There is no dicount for posting nor any compensation for this rating.","0","0","0"
"VuKbGklNbOESJSx76_EjyA","2v_meK453YAWXz4NjJ9abA","OQcvO5P3gH0cuJ-bPXwfQQ","5","2016-11-05","Is a small restaurant food is good! Also the owners are very friendly they make sure u are satisfied!","0","0","0"
"HBaAmcS9zp5rY1qiMuWygA","cdFWtOgA1PAkNYkiwzUJbQ","OQcvO5P3gH0cuJ-bPXwfQQ","5","2017-06-01","Best Mexican restaurant in Vegas. Meat is super soft and very tasty. Fried fish is delicious. Salsa is so yummy! Very friendly service.","1","0","0"
"41ORR2OPi2CP0FAoiWjwWA","60ENRcuFKNf9oeA2zWROFQ","OQcvO5P3gH0cuJ-bPXwfQQ","5","2017-07-16","I  would've like to take a before picture when it looked all nice and pretty, but it was so delicious I just couldn't wait. I had the chicken chimichanga and my friend had of the chicken burrito supreme. I will never visit Robertos, Pepe's tacos, etc. again. #obsessed","1","0","0"
"Oxz26pqpIb7dDVeuUzNZlg","Fv0e9RIV9jw5TX3ctA1WbA","OQcvO5P3gH0cuJ-bPXwfQQ","4","2017-06-20","We had originally planned on eating at the Sinaloa food truck across the street, but they had a really long line, so we decided to give Mi Pueblo Taco Shop a try. Walking inside I was greeted by a sweet young girl who also took my order and she was nice about going over the menu and what the specials included. Inside was clean and decorated nicer than I expected. There was also a good amount of customers eating inside which I took as a good sign.   I noticed they had different daily specials on the windows out front and they are totally worth checking out. I was here on a Friday and the special that day is 2 enchiladas, beans, rice and a drink all for $5.95 before tax. Great deal! The rice was lacking a bit on flavor and while the beans could have used more cheese, they did taste good and I liked the few tortilla chips on top of them. The enchiladas had a decent amount of cheese inside and the sauce tasted good. I'd for sure come back for this special again.  Al Pastor Taco ($1.75) - The tacos come meat, onion and cilantro. There's a salsa bar with veggies and containers. I grabbed some of the red and green sauce and favored the green. My taco was filled nicely and had great flavor.   Carne Asada Burrito ($5.99) - Here's where things got odd for me. Hubby and I intended to share this and he always prefers just meat, cheese and sour cream in his burritos. The girl who took our order said he couldn't have it that way and that the burrito had to have beans and rice inside. If the burritos aren't pre-made this shouldn't be a hard request at all. I saw a different girl putting meat on the grill and then put the burrito together, so I can't figure out why the burrito couldn't be customized to have the rice and beans left off. The burrito was a nice size for the price and did taste good, but it would have been better enjoyable if it could have been made the way preferred.   Great weekly deals and decent Mexican food. I'd come back.","66","42","67"
"JGIVj26nGtLgzsL4zeaP2Q","UKFgwgNM1a7Gmr0UIGPzpw","OQcvO5P3gH0cuJ-bPXwfQQ","5","2016-06-12","One of the few times I have given a business five stars. This restaurant has very good food everything on the menu is fresh and very very tasty. I've been to this restaurant probably 10 to 15 times and have never had a bad meal. Is the owner and staff of this restaurant are very nice and courteous and provide a good service and excellent food. I highly recommend this place for anything Mexican on their menu you will not be disappointed.","1","0","1"
"w3ezGmzYbucBCNB66ilE4Q","LnGDsxHFPhoCKT8sFGaViA","OQcvO5P3gH0cuJ-bPXwfQQ","4","2015-08-01","Las Vegas does not have a lot of good Mexican food unfortunately. So, when we do find one, it's always pretty exciting. This place was good. Reminded me a little of Texas, in terms of quality.  Enchilada was very tasty, great sauce. Rice and beans were both delicious. Chile Relleno needed a tiny bit more flavor, but had plenty of cheese. Great little salsa bar. Had a bite of gf's Huevos Rancheros and we agreed that they were pretty awesome. We'll be back soon.","4","1","2"
"wM9a-pB0MSnyIJ4eMmXBUw","E1b2_YD1uwufHmCsrKteCw","OQcvO5P3gH0cuJ-bPXwfQQ","5","2017-03-11","Trying to curb my taco cravings, checked yelp for a taco spot not too far from the house, when I came across the review for Mi Pueblo Taco Shop and they have a perfect 5star rating. I haven't got my food yet, but the smell coming out the kitchen is amazing. It's a Friday night in Vegas, at a hole in the wall taco shop. The single file line is out the door.....Now that's a recipe for GREAT Mexican food","0","0","0"
"fEpol5iWEiqKdbrIuHOc3A","JoATwObKNywEmAduyKdm6w","OQcvO5P3gH0cuJ-bPXwfQQ","5","2015-07-22","My daughter and I stopped in yesterday and truly enjoyed our meal. So much so we added an order to go. Just might have to give up my usual taco spot!!!! Food was great. My only critic no chips and salsa before the meal and only gives you a couple chips stuck in the great beans!!! Also might look into making up paper menus. Nothing to take home to read. The service impeccable. Will be back for sure.","1","0","0"
"rqCifVSFO9vNV9S97NoQng","BYL1E668zAEJNimiFPSA-Q","OQcvO5P3gH0cuJ-bPXwfQQ","5","2017-05-24","The carnitas sopés are the best! Carne Asada tacos are in second place...  I eat there at least twice a week, and it's fantastic every time!","1","0","1"
"XgoMPW26QuJ6duS08QXc-g","OVFCRSZ_yFEc1rAlye_Z5g","OQcvO5P3gH0cuJ-bPXwfQQ","5","2014-09-05","Talk about authentic Mexican food!! there i was in search of a new place to eat close to work. I was craving authentic tacos, as i reminisced on my favorite taco shop in san francisco.       First stop was Cardenas. It was closer to me but the lines were ridiculous and the environment chaotic. Needless to say, i left in search of greener pastures. Second stop, the las vegas chain Rigos tacos. The place gave me a creepy vibe plus their soda machine was not working. I'm all for hole in the wall places but this place was too much.      As I drove aimlessly i came across this place, Mi pueblo Taco shop. Boy was I pleasantly surprised!! my  long search of a mom & pop taco shop proved fruitful. The lady at the counter and the cook turned out to be husband and wife, and the owners. They were both extremely friendly  and the food was delicious!! they had weird pricing quirks but hopefully they figure it out. overall, 5 stars and will definitely come back again.","2","0","1"
"AL3myD9GD5Zj7YuVLq0N1w","Jl-0N4zQ6VCbvk7DFpNfJg","OQcvO5P3gH0cuJ-bPXwfQQ","5","2017-05-20","I stop by here on my way to ed fountain park when my son has soccer games.  I usually get tacos and tamales for the team and they love them more than pepes. Definitely a go to place for great Mexican food...cant wait to try other items.","0","0","0"
"6EYXqTZHxfoZgA4gIrDVrQ","C6ezDVKNyQz-aKr4OOjC4w","OQcvO5P3gH0cuJ-bPXwfQQ","4","2017-05-12","Very clean and friendly service. I had the Carne asada torta and my friend had tacos overall fairly good.  For a quick bite not bad.","0","0","0"
"0dP8Woa5xr1eNJ4eJlojlw","59-R2EWXP6EUelGzuM1UsQ","OQcvO5P3gH0cuJ-bPXwfQQ","5","2016-12-11","I was surprised it was this good it was like a home cooked meal... I purchased one posole, 3 carne asada tacos, 5 fried fish tacos, a combination of carnitas, 1 chicken nugget plate, 2 orchatas and my total was $51 not bad at all.","0","0","0"
"sG2U7rH5NSTYR3-DumVT7w","cQzo2WX1TyPEmS5jPzOUoA","OQcvO5P3gH0cuJ-bPXwfQQ","2","2017-07-15","TLDR: Lunch Specials; salsa bar available; excellent service; subpar food; convenience charge for card payment  I was really craving excellent chips and salsa so I usually have a go-to spot for Mexican fare. Learning that they were closed, I found something in the area with excellent reviews and was happy to find this location with a Yelp check-in.  I skimmed the reviews and saw several 4/5 star reviews with a couple of 2 star reviews so I decided to give this place a shot.   Service was excellent and I was impressed with the politeness and grammar used in both English and Spanish upon walking in and ordering. It reflected that the business cares about the customer and how they are perceived when spoken to by the various clientele.   I immediately placed an order for the chips and beans and was happy to see breakfast items on a menu. My foodie friend ordered a pastor burrito and I ordered chilaquiles with green sauce. Unfortunately, this is where I should've listened to the 2-star reviews.   While I believe that the food is made fresh in-house, the quality lacks and pales in comparison to the service. The beans lacked flavor, excluding the cotija cheese and the chips were stale. This is probably a storage issue. The salsa were flavorful, but lacked spice. Interestingly enough, the green salsa was the spiciest.   My friends pastor burrito was just ok. Not fantastic, not terrible. Just ok. It probably is similar to Roberto's, my terrible baseline for Mexican food flavor and service. My chilaquiles were tragic. The rice was pretty bad and the green sauce was pretty boring. It's sad to say that Del Taco has better rice, beans, and green sauce. Needless to say, I didn't enjoy the dish and I won't return anytime soon.","2","1","0"
"Eb3mICEEu0E8obitUjI8sA","ozS37Fa6pFDEEMuqU3qmvg","OQcvO5P3gH0cuJ-bPXwfQQ","5","2017-03-26","Their food is delicious!!! I got Huevos Rancheros and my bf got menudo. He loved it! The lady at the register was friendly and super nice! The coffee is really good too!!","0","0","0"
"jM1RJRrF4OUU0OyZSTgFeg","hcK85MiLdfYYrIOuzKtJQQ","OQcvO5P3gH0cuJ-bPXwfQQ","5","2017-06-12","Great tacos de carne asada.  I really liked the salsa.  I added rice and bean and I am glad I did.  Delicious and very affordable.","0","0","0"
"LbwHTp9GEKk5xoQzIjITeg","Rh2YtAmvRxDonUqZlxJDIw","OQcvO5P3gH0cuJ-bPXwfQQ","5","2015-02-09","Wonderful divey taco shop with awesome Mexican food. Highly recommend the tacos dorados, cheese enchiladas and chips with the salsa bar. The flavors are amazing! They must do most of their business as take out since it is so small, but the eating area is clean and nice. Don't be swayed by the strip mall. Definitely worth a stop.","3","0","0"
"PM5aFLiwbKWDm_AtC71-3Q","d9y5MjVOgxcP4Zc7qjowdA","OQcvO5P3gH0cuJ-bPXwfQQ","5","2016-11-03","I walked in my scrubs and the owner asked me how I found out about his place.  I told him Yelp and that I was in the area for a school assignment and lived across town.  He never heard of Yelp and didnt know that his place has a 5 star rating.  He was wearing an SD cap and I found out he lived in San Diego.  If you ever had authentic San Diego Mexican food you know this place is legit, because it reminded me of that.  I found this to be a unique experience with genuinely nice restaurant owners not catering to Yelp reviewers.  Hopefully that won't change after my random stop there.  I had a carnitas burrito, cachete taco and carne asada taco, and a horchata (no not Smart Chata).  Overall the carne asada was the most flavorful with a nice charred taste.  The cachete was tasty.  My carnitas burrito was good too, similar to the SD burritos I miss.  Tortilla, meat, rice, beans, and since I'm originally from San Francisco I added some sour cream with guacamole.  The salsa was also fresh and tasty.","3","0","3"
"SxPbDeghypuf3ESF3CzXQw","5IgLVsxowG4gcIJK8ovSzQ","OQcvO5P3gH0cuJ-bPXwfQQ","5","2015-02-10","THE MOST AUTHENTIC MEXICAN FOOD IN TOWN.  Do not sleep on this spot, if you are ever in Vegas definitely stop by... I cant think of my favorite dish because you cannot go wrong with anything on the menu; The menudo The cocteles, The enchiladas. Mm everything is bomb! and always great customer service and very clean nice little shop. Love it.","0","0","0"
"gonKSjSZrYkOzhdHBaCDeg","vb9UuBS_qwUR-EGsJKlSFw","OQcvO5P3gH0cuJ-bPXwfQQ","5","2015-10-20","Great place if you want some traditional fresh Mexican food ! The over ceviche which is one of my favorite dishes, to to be honest it's one of the best ones I had !","0","0","0"
"_dROxY7jxG8hH4eGOi6-nA","IeVYKQZObeFnKTa04oB5Gg","OQcvO5P3gH0cuJ-bPXwfQQ","5","2017-06-24","They have tamarindo! My girlfriend and I have been looking for weeks and finally found our new go to spot!  Thanks!","1","0","0"
"6SaVHkF1qwexY-nbGaxlPg","6pzA8EDhHgW3A5-rBObhBA","OQcvO5P3gH0cuJ-bPXwfQQ","5","2016-07-05","Craving for authentic Mexican Food and feeling adventurous and out of your comfort zone. Gotta try this humble and family operated place. Everything I had was simply delicious and would go out of my way to venture in this neighborhood for Tacos and Mexican food  The cashier/server was very friendly and asked if it was my first time here. She answered my questions and made me feel welcomed. I originally was going to order Tacos only but the enchilada combo grab my attention and got the combo with a single order of Carne Asada Taco on the side because I had to get a taco too.   When the order finally arrived at my table. I got the three different salsas that was available at the salsa bar. From the first bite of my taco and enchiladas 1-beef & 2-chicken combination along with the fresh salsas. Every bite was amazingly flavorful and authentic. The whole experience was great and felt like I was taking a short vacation in Mexico!","4","1","2"
"FiNxxZQA_b6HEuTumHaEag","Nym1l6I0gMFrr9WCAcMO0w","OQcvO5P3gH0cuJ-bPXwfQQ","5","2014-11-20","Man this place is bomb dot com -  Let me tell you when it comes to Mexican good I'm picky  there's so many spots here in vegas so when something really catches your taste buds then you know lol","2","0","0"
"7NzfZCe-pdsY0oMJr17MZw","2qLnlH24c6wdPn5XvG6DLg","OQcvO5P3gH0cuJ-bPXwfQQ","5","2017-06-16","We were in Vegas for a few days and after eating at a number of the expensive resort offerings we found this little diamond in the rough. This place ROCKS! Totally authentic mexican food. The tacos and flautas are legit and hit the spot dead on. We are mexican and we know our cuisine and you can't go wrong eating here. Just stop reading this review and try it. Like now.  Go!","1","0","1"
"D26ZjupzxrjQHEt-wtCN7w","WRWvu_McOkXguooZftZJmw","OQcvO5P3gH0cuJ-bPXwfQQ","5","2017-05-05","Yes its definitely a five star hidden gem. A great pit stop on the way to Moab. Everything was fresh right down to the rice. A nice older couple seem to run the restaurant. The prices are fair, it's probably not not in the best part of N. Vegas but worth trying out, we'll be back.","0","0","0"
"Y5kb-t6_mRVHnr2Yv778ig","CL2Zdl7Uynf4h7QwxMNkuQ","OQcvO5P3gH0cuJ-bPXwfQQ","2","2017-05-05","I ordered carne asada, fish, & chicken tacos. Tacos are really small & over cooked. Was really disappointed, expected a lot based on the reviews I read. You're better off going to a taco truck. I really hate how over priced tacos are now. Wouldn't mind paying $2-3, but at least give me what I'm paying for.","0","0","0"
"onvMwlNZZjZ4mIz_2z7kvA","Wt5mt4Byw5Mn3U41jUnCAQ","OQcvO5P3gH0cuJ-bPXwfQQ","5","2017-07-16","MI Pueblo is the BEST TACO SHOP IN VEGAS. The owners are so sweet and kind. Their food is absolutely delicious. I have had every single meal available here, and I NEVER once had anything that was bland or stale. They Cook everything fresh, despite what others think. Even though I'm guessing those people have never seen the cooks in action. This place is 1 IN A MILLION! I've been going since they've opened in 2008. I have never regretted going there. I ABSOLUTELY LOVE THIS PLACE AND THE OWNERS! It's such a shame when people check in on here to get free food and THEN POST NEGATIVE REVIEWS ABOUT THE FOOD THAT THEY ACTUALLY HAVE TO PAY FOR LOL.  YOU WONT FIND MANY CLOSE TO HOME, DOWN TO EARTH AND DELICIOUS PLACES LIKE THIS.","1","0","0"
"EgQjBwQ1cA0ymPZ-uYgGHw","OMnGx8677VNH3-n3FGujYw","OQcvO5P3gH0cuJ-bPXwfQQ","5","2017-01-03","I haven't eaten yet but if it tastes half as good as it smells I'll be happy. The staff was super friendly thumbs up!!","0","0","0"
"s2GQlpCicvkBv0vzDj235Q","wwucRFQsufzBZBxsNBDkwQ","OQcvO5P3gH0cuJ-bPXwfQQ","5","2015-05-12","By far the best burrito and salsa I have ever had. This place is way across town from where I live but i go there just to get my burritos, yes if I'm gonna go across town I better get two burritos to go.","0","0","0"
"eDQEgk6uoZEATcDzwAi10w","8ToVL-FXEu5kjh3LC7kBRQ","OQcvO5P3gH0cuJ-bPXwfQQ","5","2016-07-22","Legit food!! I had the chilaquiles with red sauce comes with eggs,  beans and the best rice I've had in a long time.. Definitely recommend this spot. They know how it's done","1","0","0"
"EEAdWv92XwDgFnJOmacXHA","u5o_QDwRPQW8gjgFudu9bg","OQcvO5P3gH0cuJ-bPXwfQQ","4","2016-12-01","Came here while visiting my friend in Vegas.  We wanted tacos and I'm picky about Mexican food.  This place totally hit the mark.  Not only was it delicious, the lady taking orders was super sweet and a really good salesperson.  I was debating on getting carne asada fries because i had already had fast food that day.  Here's how the convo went:  Her: do you eat them [carne asada fries] every day?   Me: well, no... Her: then they're not so bad then Me: good point  Salsa bar was on point and the spicy carrots and onions were crispy and super hot.  Yum.","2","2","2"
"Z5bwRMa0dR_e5Pm_cz5zog","zc6cucEAy6Qxkxr9ZUkqbw","OQcvO5P3gH0cuJ-bPXwfQQ","4","2016-10-14","Once again. The good was hot and fresh tasty, the customer  service  is friendly  and personal. This what to expect from a family owned restaurant.   The burritos  are very nice sized /over sized for your $$ the torta  is good also,  all the food is good sized portions","1","0","0"
"LVRBgIK3CP5Ap__LlczgRg","0Fhcuf1rKxSZOWQ4J56udw","OQcvO5P3gH0cuJ-bPXwfQQ","5","2017-02-19","This place is special. All their food is made with the care you would expect at a family gathering. The hospitality is incredible. This is NOT your typical Mexican turn-and-burn kind of place. Every dish I've ordered thus far has been absolutely fantastic...Well assembled and delicious. Personally, I love the ""caldo de pollo"" (chicken soup). I could eat it every day! This establishment is a definite winner in my book!!","1","0","0"
"4UPAFxc0r-KrJ20p4LOrRA","TqoqUHUCiMVG4_PEZK4qkQ","OQcvO5P3gH0cuJ-bPXwfQQ","5","2016-06-16","Best fish tacos! I also like the Carne Asada fries. The first time I had a chicken chile verde burrito.  But once I tried the fish tacos, I was hooked! The other burritos are good, too. My husband loves the pickled/peppered veggies. He gets a bagful and eats them while we wait. Family owned and operated. Friendly, cheerful staff.","1","0","1"
"kC5ecZO35TPFuSV_H9poew","qDdc-EvTGorahsfXnBYAEw","OQcvO5P3gH0cuJ-bPXwfQQ","5","2016-05-19","The food is very tasty, generous portions.  Had the combo with cheese enchilada, Carne Asada taco and chili rellenol with rice and beans.  Hubs had the Carne Asada plate .","0","0","0"
"_SfOk_nyyitCBgZSEi6G_A","VDjzt6N--TMXH4E7Y6ialQ","OQcvO5P3gH0cuJ-bPXwfQQ","5","2015-07-29","I really enjoyed it here. The cheese enchiladas and carnitas taco were really good. The staff is very friendly, always nice to see positive happy people. I will be back for sure! give this place a try, you will enjoy it.","2","0","1"
"qbkhfoOAP43YREAH2t-PTQ","FEwPxhjdVKxSPVQQAHX2gg","OQcvO5P3gH0cuJ-bPXwfQQ","4","2017-05-14","I really liked the 'mom and pop' feel of this little Mexican restaurant, and the quality of the food was really good. Solid four stars. The complimentary chips and beans I got for my Yelp check-in were excellent. I upgraded to a larger size beans in order to share. You can tell these beans are the real thing.... slow cooked with love for the flavor and not smashed too much. Yum. My husband has the carne asada burrito, it was huge, their version came with rice and beans inside the burrito, a little different than other taco shops I have been to. I had the combination plate, Chicken Enchilada, Chiles Relleno, and Chicken Taco. This plate came with rice and beans. Everything was excellent, but the star of the show was the taco! My next visit I will definitely try some of the other tacos on the menu. The salsas in the salsa bar were amazing, I put it on everything!  So here is the bad news about this place........ the neighborhood! This shopping center and parking lot is scary! There are so many people loitering in front of the next door liquor store. I am glad I was with my husband, I really would not have felt safe coming here without him and coming here after dark.......","3","1","2"
"bepPxZRTYhy4jWfWu_eCHg","7JQsASQOgJAPuneUTxYZEg","OQcvO5P3gH0cuJ-bPXwfQQ","5","2017-02-19","This place is great! The food is amazing. Had a plate of chilaquiles and my wife had the machaca. The portions were generous and tasty. I highly recommend this place if you you in the area and want great Authentic Mexican Food!","1","0","0"
"K9RjHW__5WqYMZDdkFsneA","y74WFWeQHLCC9AbxuRWcSg","OQcvO5P3gH0cuJ-bPXwfQQ","5","2014-10-30","Outstanding. Visiting Las Vegas and happened upon this place. Having been raised in San Antonio, I feel like I know great Mexican food. And we found it here. The food is very authentic because they know how to build the meal with a great foundation. The chips and homemade tortillas are to die for. We all had various tacos, chicken and asada. Their burritos are huge!  The best part of the meal was the carnitas nachos. Don't miss out on them. When I'm back in vegas again, a meal here will be on my itinerary.","2","0","1"
"wL9hpAfkMx6FueuuoMOo4w","o5hZLSgek20FFV0-aHY6TA","OQcvO5P3gH0cuJ-bPXwfQQ","5","2013-09-26","Dont sleep on this spot! Consistently great, authentic mexican food. We've tried many other places but continue to return here!","2","0","0"
"I_xF8TrcJkiamX3lDBlstg","Ozg8dKXznd911fQx-6qy1g","OQcvO5P3gH0cuJ-bPXwfQQ","5","2015-11-13","Seemed questionable from the outside especially only the outside thou when u walk in the atmosphere changes the cashier / sever name is Sarah she was really helpful I been here twice now I've tried the cabesa tacos, the lague  tacos, fish tacos, the shrimp cocktail  and the carnitas torta with fries all of it was outstanding I am surprised on how good it was they have a large variety of menu options which in sure there all good the cabesa was tender and juicy the torrilla they use was thin and delicious tasted home made fish taco was fresh it was fried still good thou love how fresh the tomatoes where , shrimp was perfect and Devined  correctly had a good amount of avacodo too which I loved , the carnitas were tasteful and not overcooked lettuce was fresh and crunchy over all I would say they put a lot of love in there food which makes it super good new spot for my Mexican food cravings I highly recommend this place","0","0","0"
"2mEJoiRnFmlyJKe10lpi_w","yvWZJA-h-UEC_Xf51eE0OQ","OQcvO5P3gH0cuJ-bPXwfQQ","5","2016-06-28","Amazing, fresh and inexpensive! First time here and I love it.","0","0","0"
"AQgNtmL_BZ1sNw0UsekBtw","7vomvJjoNBthj7iVo1lFqg","OQcvO5P3gH0cuJ-bPXwfQQ","5","2017-02-15","Was in town on a short layover and was looking for some real deal Mexican! This place was so good! The sopes were amazing!!!!!  Will definitely be back when in the area!","1","0","0"
"Pmbh65APyWtZ2A9UNkNZfQ","w7Q-WMxPuznP-P2Y79ICng","OQcvO5P3gH0cuJ-bPXwfQQ","5","2014-04-28","Only 1 review?? C'mon! This place has awesome food!! It's rough around the edges but don't let it fool you. Tacos! Burritos! 3 different soups!","3","1","1"
"Nyb_AnA1nP6u1uPQ2p_RNg","vlcsGHaSPAS_Bb59EW6E8g","OQcvO5P3gH0cuJ-bPXwfQQ","5","2015-11-03","Mi Pueblo Taco Shop is a family owned treasure in Las Vegas , Nevada.  Owners Juanita and Manuel make homemade Mexican food in small batches and treat E everyone like family.  It is outstanding.  Paulette Motzko","1","1","1"
"iHJQRpIvKhStGT6ruIaqQA","yianVcvmHzUE08AVOz1iKw","OQcvO5P3gH0cuJ-bPXwfQQ","5","2017-07-21","This place is great. I come here almost every day. Today I had a California burrito which was incredible. The fish tacos are always delicious. I really enjoy coming here, the staff is nice and it's always clean.","4","0","0"
"2z563U4pdgYWkYKfpYhhBg","nx7twsWNlAMrsr1CBIW6AA","OQcvO5P3gH0cuJ-bPXwfQQ","5","2017-07-08","Finally found the BEST Mexican restaurant in Las Vegas!! The food is not only fresh but comes in large quantities! Will come back again and will recommend this place to my family and friends!!","0","0","0"
"ulzjicEUXoVff3d7VWzkeA","nbVr7Q8j48hBODKrMOZdKQ","OQcvO5P3gH0cuJ-bPXwfQQ","5","2016-07-29","Bomb! Fresh ingredients!  Yummy to my tummy!  I would highly recommend this gem. This meal hit the spot, next time I'll try the enchiladas.....","0","1","0"
"8-sknGIGoDXqudrGyMNS_g","pmPsoV2jamfOgWOgiZxLmA","OQcvO5P3gH0cuJ-bPXwfQQ","5","2016-12-29","I will say our expectations were guarded when we pulled up, but step inside and receive a warm greeting and look at the menu, you know all will be good, and it was. The burrito was tasty and plentiful, ""sandwich"" with the fried pork, Pastor tortas, absolutely satisfying, simple and perfect. The hot salsas were fun and tasty. Enjoy","0","0","0"
"aWeHWmKbYRWbNh5_rSHd3Q","ynaNvoqkUEm0Uoh06EltZQ","OQcvO5P3gH0cuJ-bPXwfQQ","5","2017-03-26","Small mom and pop joint. Food is really good here and service is great, super friendly and welcoming.","0","0","0"
"Sz7Q5Ylx6zeuxPqKx1Ohbw","bmjZVlu-GdjK6f_c8FLNvw","OQcvO5P3gH0cuJ-bPXwfQQ","5","2015-12-05","Very good I recommend the fish tacos!!! And carne asada tacos! All with red salsa!! Bomb!!!","1","0","1"
